date_maj,type,jeux
2025-12-15,MISE À JOUR,"Steps of Debauchery,  The Headmaster,  Depth's Revival,  Heritage"
2025-12-15,AJOUT DE JEU,"Isolated with Mom,  The Monstrous Horror Show,  Two Faceless Adventures"
2025-12-14,AJOUT DE JEU,"Persona 4: Rise Gaiden,  Shin Megami Tensei: Training the Demon,  Sofia's Secret,  Shadow Island,  Where It All Began (Uncut Taboo Edition),  Android LIFE,  Caprice- Domina Noctis,  Castle Darkstone,  Femdom Academy"
2025-12-14,MISE À JOUR,"Devoted Wife,  Streaming for Love,  Seducing the Devil,  Lens Lust"
2025-12-13,MISE À JOUR,Hail Dicktator
2025-12-13,AJOUT DE JEU,"Crystal Desires,  Schoolgirls vs Elite Teacher Shinobu,  Monster Girl 1,000,  Futanari Tales,  Second Class,  Treacherous Desires"
2025-12-12,MISE À JOUR,"Aura Colors,  Another Chance,  Personal Assistant: Blackheart Edition,  Ravager,  Hard to Love,  Shelly's Future Past"
2025-12-12,AJOUT DE JEU,"Ero Scheme,  Bible Black: La Noche de Walpurgis - Ren'Py Remake,  Captured by Dark Elves: Arachna’s Return,  Fetish Stories: The Asylum,  Futa School,  We Need Money,  Taffy Tales,  Taffy Tales Halloween Special,  Taffy Tales Christmas Special"
2025-12-11,MISE À JOUR,A Wife and Mother
2025-12-11,AJOUT DE JEU,"Shadows,  Cutting Room,  Hardcore Femdom,  Femdom Bullies,  Corrupted World"
2025-12-10,MISE À JOUR,"Bored Wife ,  Hell SexBurger,  Cursed Forest Quest,  Spirit Lover,  PokeLewd: For Waifus,  Going for Goal,  LittleMan Remake,  A Wife and Mother,  Summer in the City,  Alenja's Adventures,  Wild Cats,  Alpha Omega"
2025-12-10,AJOUT DE JEU,"An encounter from the past,  UFO,  Orange Smash,  Otoko Orgy at Maid Boy Manor,  The Pervert Boy,  The Fiancée,  Riverside Cabin,  Love and Temptation,  Lisa Total Investigation!,  Adventures of Greatbay,  Cara in Creekmaw,  Willow Blue Remake"
2025-12-09,MISE À JOUR,"How to Fuck in a Zombie Apocalypse?,  Sexbot II: Recalibrated,  Imperial Bureaucracy Hero,  Altered Destiny"
2025-12-09,AJOUT DE JEU,"Too Lewd!,  FEMBOY HOTEL,  Where the Heart Is,  NSFW: Natural Selection Female Wrestling,  The Roommate,  Femboy Prison,  Star Warrior and Space Girls"
2025-12-08,AJOUT DE JEU,"Takei's Journey,  Rising Bliss"
2025-12-08,MISE À JOUR,"World Tamer,  Normal Life under Feet,  My Netorase Obsession,  The Simpsons Dating Sim,  Bare Witness"
2025-12-07,AJOUT DE JEU,Konoha Milfs
2025-12-06,MISE À JOUR,"Boundaries of Morality,  Naruto: Kunoichi Trainer,  Symphony of the Serpent,  Project Myriam - Life and Explorations,  Lewd Invasion,  Zero to Harem Hero: A Hentai Isekai Adventure,  Persona 4: Rise Gaiden,  City Devil: Restart,  BizzareHolyLand"
2025-12-06,AJOUT DE JEU,"Diana Story,  Beast Control"
2025-12-05,MISE À JOUR,"Last Man,  Streaming for Love,  Dreamer Life,  Way of Corruption"
2025-12-05,AJOUT DE JEU,"Date Night,  Wilting Hope,  Porcelain Dolls,  Adored by the Devil,  Because I Love Her,  A Mother's Love,  Mistress Chains And Humiliation,  Elvis Humiliation"
2025-12-04,MISE À JOUR,"Hard to Love,  Summertime Saga,  Heliorise,  Naomi: Breaking the Queen Bee,  Blood Spirals"
2025-12-04,AJOUT DE JEU,"AIRevolution,  School of Love: Clubs!,  DropOut Saga"
2025-12-03,MISE À JOUR,"League of Domination,  Regret Island,  Once a Porn a Time,  Camp Pinewood Remix,  In for a Penny,  Straitened Times,  The Nexus,  The Necromancer Arises"
2025-12-02,MISE À JOUR,"SlutCraft: Heat of the Sperm,  Succubus Trick: Grown Up Problem,  Isle of Fall,  Bubbles and Babes,  Fetish Locator: S&M Studio"
2025-12-01,MISE À JOUR,"Goodbye Eternity,  Futaisekai - A Tale of Unintended Fate,  Sword Art Online: The Trap of Breath Concealed Magic,  Surrendering to My Crush,  First Change"
2025-12-01,AJOUT DE JEU,First Change
2025-11-30,AJOUT DE JEU,"Mita's Playhouse,  Discipline -The record of a Crusade- Ren'Py Remake"
2025-11-30,MISE À JOUR,"Multiverse Ballance,  Sword Art Online: The Trap of Breath Concealed Magic"
2025-11-29,MISE À JOUR,"Formula Zero,  Cosy Cafe,  Myth of Slayer,  Heliorise,  Eruption Imminent,  Love & Sex Second Base,  Henry's Adventures,  Grandma's House,  Anna Exciting Affection,  The Wants of Summer,  SnowStorm"
2025-11-29,AJOUT DE JEU,"Divine Heel,  Studio Hearts,  Destiny's Embrace,  Quarantine Libido,  Edgefield,  Kidnapped by the Mistress,  FemDom Stories,  Illegal Aspects of Legal Slavery"
2025-11-28,MISE À JOUR,Our Red String
2025-11-27,MISE À JOUR,"Attack on Survey Corps,  Unexpected Consequences,  Simple Days"
2025-11-27,AJOUT DE JEU,"Girl Scout Island,  Beyond Tomorrow"
2025-11-26,MISE À JOUR,"Devoted Wife,  Pill King,  Jennifer's Life,  Ravenous,  4 Years in Tehran,  DickmonX Remake,  Misanthropy,  Midnight Paradise,  Guilty Pleasure"
2025-11-25,MISE À JOUR,"The Seven Realms,  Streaming for Love,  Nephilim"
2025-11-24,MISE À JOUR,"World of Sisters,  Bible Black -The Infection- Ren'Py Remake,  Lost & Bound,  Monster Girl 1,000"
2025-11-24,AJOUT DE JEU,"VIRTUAL DAUGHTER,  The Seven Seas"
2025-11-23,AJOUT DE JEU,Lucky Mark - Unofficial Ren'Py Port
2025-11-23,MISE À JOUR,Whispers of Desire
2025-11-22,MISE À JOUR,"House Party,  Timestamps: Lost Love,  The Wish,  High School Master,  Worlds of Wonders"
2025-11-22,AJOUT DE JEU,Lust Brawl
2025-11-21,AJOUT DE JEU,"Three Days with Domina,  Package Perfect,  Project Atmosphere"
2025-11-21,MISE À JOUR,"Crystal Desires,  New Beginnings in Japan,  The Fixer,  Shelly's Future Past,  My Cute Roommate 2,  Jimmy Awkward Adventures,  Blacked House,  A.I.D.A,  A Family Venture,  Ariana’s Perverted Diary"
2025-11-20,MISE À JOUR,ALT CTRL DEL
2025-11-19,MISE À JOUR,Normal Life under Feet
2025-11-18,AJOUT DE JEU,Gynocracy
2025-11-18,MISE À JOUR,"Regret Island,  Bible Black -The Infection- Ren'Py Remake,  Milfylicious,  Horton Bay Stories - Jake"
2025-11-16,MISE À JOUR,"Dimitrescu's Trial,  ChariKiss,  LittleMan Remake,  Symphony of the Serpent,  Polyturnon"
2025-11-16,AJOUT DE JEU,"The Last Embrace,  The Arson Betrayal,  Breaking Point,  Cradle Beyond the Veil"
2025-11-15,MISE À JOUR,"Hail Dicktator,  Single Mother,  Empress Game,  My Netorase Obsession,  A Family Venture,  Grandma's House,  Midnight Paradise"
2025-11-14,MISE À JOUR,"Frozen Past,  My Bimbo Dream,  Love by the Water,  Hokage's Life,  Nympho Tamer,  Friends in Need,  Dreamland"
2025-11-14,AJOUT DE JEU,The Office
2025-11-13,AJOUT DE JEU,"Ample Chests,  Last Days,  Shroud"
2025-11-13,MISE À JOUR,"Renryuu: Ascension,  Multiverse Ballance"
2025-11-12,MISE À JOUR,"Town of Magic,  Futa Family"
2025-11-11,AJOUT DE JEU,"World Tamer,  The Better Deal,  Welcome to Wimblewick,  Echoes: The Lies We Tell Ourselves,  Pill King"
2025-11-11,MISE À JOUR,No More Money
2025-11-10,MISE À JOUR,"Stuck in My Game,  Tenebris Legion,  Myth of Slayer,  Lustfield,  Back to the Past,  Locked in Chastity,  True Husband,  Censored for Betas,  Viral Rivalz,  Another Chance"
2025-11-10,AJOUT DE JEU,Empire Of Lust
2025-11-09,MISE À JOUR,"Streaming for Love,  Stray Incubus,  Steps of Debauchery,  Reincarnated in Submission,  Pandora's Box 2"
2025-11-09,AJOUT DE JEU,"Motherless,  New Family,  Lens Lust,  Camp Morningstar,  Town of Magic,  My Bimbo Dream,  SEXXX Girls,  Innocent Witches,  Pizza Hot!"
2025-11-08,MISE À JOUR,"A Struggle with Sin,  Vae Victis - Khan: Conquer, Ravish, Breed,  Succubus Contract II,  Wild Cats,  Attack on Survey Corps,  Sara - Oh Daddy Part 2,  Young Again,  Camp Pinewood Remix"
2025-11-08,AJOUT DE JEU,Wild Cats - Side story
2025-11-07,MISE À JOUR,"Last Man,  Reconnections,  Bright Lord,  Betflix,  Forbidden Kin,  Lycoris Radiata - Version:,  Step Bi Step,  Streaming for Love"
2025-11-06,MISE À JOUR,"Shattered Minds,  Steps of Debauchery,  Persona 4: Rise Gaiden,  Symphony of the Serpent"
2025-11-06,AJOUT DE JEU,Love by the Water
2025-11-05,MISE À JOUR,"How to Fuck in a Zombie Apocalypse?,  The Island of Milfs,  Away from Home,  In for a Penny"
2025-11-05,AJOUT DE JEU,Trick Or Tease
2025-11-03,MISE À JOUR,"Our Home,  Innocence or Money,  My Best Deal,  Getting Intimate,  Lewd Invasion,  Crystal Desires"
2025-11-03,AJOUT DE JEU,"Al Mara Academy,  Bible Black -The Infection- Ren'Py Remake,  Alpha Omega"
2025-11-02,AJOUT DE JEU,"Lewd Realm Sacrifice Araka ~A JK Exorcist Horror RPG,  The Journalist,  Zero to Harem Hero: A Hentai Isekai Adventure"
2025-11-02,MISE À JOUR,"Bright Lord,  Spooky Milk Life,  Regret Island,  How I Became a Hero"
2025-11-01,MISE À JOUR,"B.E.S.T,  Academy34,  Angel’s Love,  Becoming a Femboy,  My Cute Roommate 2,  Escape from Ivy and Piper,  Sex Gods,  Streaming for Love,  Surrendering to My Crush,  Horny Hill"
2025-11-01,AJOUT DE JEU,"Imperial Bureaucracy Hero,  Anna Exciting Affection chapitre 1"
2025-10-31,MISE À JOUR,"SWM: The Lurking Shadow,  Family Mysteries,  Rick and Morty: Another Way Home,  Girls on a Train,  Tales of Terrara,  RWBY Rise Of The White Fang"
2025-10-31,AJOUT DE JEU,Harmony Girls
2025-10-30,AJOUT DE JEU,"Etlina's Principle,  Maid to Please,  Defending Lydia Collier,  Overlord H,  Lust Theory S2"
2025-10-30,MISE À JOUR,"Seeds of Chaos,  Spirit Lover,  Grandma's House,  Simple Days"
2025-10-29,MISE À JOUR,"Escape from Ivy and Piper,  SWe1: The warrior's heart,  Driven by Desire,  World of Sisters,  Vae Victis - Khan: Conquer, Ravish, Breed"
2025-10-28,MISE À JOUR,"Barely Working,  Unexpected Consequences,  Countess in Crimson,  Ravager"
2025-10-28,AJOUT DE JEU,Girlfriend
2025-10-27,AJOUT DE JEU,"Mila AI,  Katia and Dungeon Quest!,  Life's Payback,  The Fixer,  Carnal Contract,  Deep Vault 69,  Sky Resort 3,  Sky Resort 2,  Sky Resort - Delphi & Jessy"
2025-10-27,MISE À JOUR,"Amnesia,  Blackmail and Education,  My Loyal Pets"
2025-10-26,MISE À JOUR,"Worlds of Wonders,  Homelander,  Guilty Pleasure,  Her Desire,  Big Brother Ultimate"
2025-10-26,AJOUT DE JEU,Worlds of Wonders
2025-10-25,MISE À JOUR,"FutaOS,  Jason, Coming of Age,  Being Super,  Milfy Day,  Ring of Lust,  Welcome to Erosland,  Wishes"
2025-10-24,MISE À JOUR,"Boundaries of Morality,  Mind Control,  FreshWomen,  Camp Pinewood Remix,  Multiverse Ballance"
2025-10-23,MISE À JOUR,"Westview Academy,  Shadows of Desire"
2025-10-23,AJOUT DE JEU,"Westview Academy,  The Genesis Order - Autre version,  Artemis,  MILF Express,  MILF Sex House"
2025-10-22,MISE À JOUR,"Succubus Contract II,  Love & Sex Second Base,  Accord,  Big Brother Ultimate,  Sexploitation,  Artemis"
2025-10-22,AJOUT DE JEU,"JPDE Refrain - Sonata of Fire,  JPDE2 - Adagio of Darkness"
2025-10-21,MISE À JOUR,"The Fall of Galadriel,  The College,  City of Dreams,  Law School,  A Girl on a Train"
2025-10-21,AJOUT DE JEU,"Fog of War,  Tenebris Legion,  Unexpected Consequences,  Pokemon Academy Life Forever"
2025-10-20,MISE À JOUR,"The Wish,  Regret Island,  Two Faceless Adventures"
2025-10-20,AJOUT DE JEU,"The Monstrous Horror Show,  One Last Salty Kiss"
2025-10-19,MISE À JOUR,"Shattered Minds,  Streaming for Love,  Symphony of the Serpent,  Incest,  Depth's Revival"
2025-10-19,AJOUT DE JEU,Attempted Redemption
2025-10-18,MISE À JOUR,Hail Dicktator
2025-10-18,AJOUT DE JEU,My Sister's Devious Plot
2025-10-17,MISE À JOUR,"Hell SexBurger,  Crystal Desires,  Hornycraft,  Futadom World - Binding Sim,  Horton Bay Stories - Jake"
2025-10-17,AJOUT DE JEU,NTR Tavern
2025-10-16,MISE À JOUR,"Barely Working,  University Days,  Whispers of Desire,  Bad Memories,  Straitened Times"
2025-10-15,AJOUT DE JEU,"Viral Rivalz,  Mystic Valley"
2025-10-15,MISE À JOUR,"Futa Family,  Grandma's House,  Empress Game,  The Cabin - Summer Vacation,  Alice: A Hard Life,  Misanthropy"
2025-10-14,MISE À JOUR,"How to Lose One's Virginity,  Devoted Wife,  Spirit Lover,  A Day at the Spa,  Way of Corruption,  Fetish Locator: S&M Studio,  Summertime Saga"
2025-10-14,AJOUT DE JEU,"City of Dreams,  Family Island"
2025-10-13,MISE À JOUR,"Lockdown 2024,  Our Red String,  Demon Charmer,  Dimitrescu's Trial"
2025-10-12,AJOUT DE JEU,House of Hearts
2025-10-12,MISE À JOUR,"Renryuu: Ascension,  The Awakening"
2025-10-11,AJOUT DE JEU,"Tokyo Hotel,  Molly's Life,  Sarah Visit,  Clementines Visit,  My Life in a Fantasy Kingdom,  Futa's World of NTR"
2025-10-11,MISE À JOUR,"Divimera,  Beauty and the Thug,  Mother Lovers Society,  Shadows of Desire"
2025-10-10,AJOUT DE JEU,Aurora Protocol
2025-10-10,MISE À JOUR,"A Man for All,  LittleMan Remake,  In for a Penny"
2025-10-09,AJOUT DE JEU,"Behind The Closed Door,  Idle Hands"
2025-10-09,MISE À JOUR,"Hey Phil,  Exposed,  The Simpsons Dating Sim"
2025-10-08,MISE À JOUR,"Lemuria,  Steps 4 Happiness"
2025-10-08,AJOUT DE JEU,"May's Summer Vacation,  Welcome to Hell - The Vampire Chronicles"
2025-10-07,MISE À JOUR,"Tales from the Unending Void,  Sinful Vampires,  Multiverse Ballance,  Braveheart Academy 2,  Another Chance,  The King of Summer"
2025-10-07,AJOUT DE JEU,"Breeding Island 3 ~The Return~,  Breeding Island 2,  Breeding Island"
2025-10-06,MISE À JOUR,"How to Fuck in a Zombie Apocalypse?,  Game of Whores,  The Singer"
2025-10-06,AJOUT DE JEU,Devoid
2025-10-05,MISE À JOUR,"Devoted Wife,  Naked Ambition,  Gomamon Trainer,  Project Myriam - Life and Explorations"
2025-10-05,AJOUT DE JEU,Lucky Janitor
2025-10-04,AJOUT DE JEU,"Just for You - Kinetic Novel,  Kiss Me One More Time,  Summer's Gone (Uncut Taboo Edition),  The Void of Deviance,  Sinful Success"
2025-10-04,MISE À JOUR,"Symphony of the Serpent,  Secrets of the Family,  Succubus Contract II,  Desert Stalker,  Price of Power,  Simulation 69,  The College,  The Fall of Galadriel"
2025-10-03,MISE À JOUR,"Last Man,  Cabin Cruise,  Summer in the City,  Sinful Vampires,  Four Elements Trainer,  The Fiery Scion,  Grandma's House,  Guilty Pleasure,  Living with Vicky,  Milfylicious,  Simple Days"
2025-10-03,AJOUT DE JEU,"Sexbot II: Recalibrated,  Jimmy Awkward Adventures,  Dreamer Life,  The Island of Milfs,  Sinful Vampires,  Blacked House,  Angel’s Love ,  Isle of Fall,  Inside the game"
2025-10-02,MISE À JOUR,"Tales from the Unending Void,  60 Days Of Us,  Harem Hotel,  Regret Island,  Crystal Desires"
2025-10-02,AJOUT DE JEU,Shut Up and Dance - Halloween Episode
2025-10-01,MISE À JOUR,"How to Lose One's Virginity,  Nephilim,  Sword Art Online: The Trap of Breath Concealed Magic"
2025-10-01,AJOUT DE JEU,Wife Promotion
2025-09-30,AJOUT DE JEU,The Perfect Dress
2025-09-30,MISE À JOUR,"Yuri University,  Spirit Lover,  Rick and Morty: Another Way Home"
2025-09-29,MISE À JOUR,How to Raise a Happy NEET
2025-09-28,MISE À JOUR,"Golden Mean,  Ravenous,  Mother NTR Training,  Tales from the Unending Void,  DeadMoon Survival,  My Best Deal"
2025-09-27,MISE À JOUR,"Mind Control,  Spooky Milk Life,  Altered Destiny,  Aura Colors,  Cartel Simulator,  Shelly's Future Past,  Witch Trainer: Silver Mod,  The Shadow over Blackmore"
2025-09-27,AJOUT DE JEU,Our Last Spring
2025-09-26,AJOUT DE JEU,"Holdcraft Chronicles: Aki,  Temporal Breeder,  Shut Up and Dance,  Falling Stars,  Cocklemouth Village,  The Adventurous Couple,  One Day at a Time"
2025-09-26,MISE À JOUR,"A Struggle with Sin,  Love, Honor, Betray,  Live to Fight,  Marnie's Moment,  Naked Ambition,  Lovephobia,  The Adventurous Couple"
2025-09-25,AJOUT DE JEU,Yesterday's Crossroads
2025-09-25,MISE À JOUR,Hooked!
2025-09-24,MISE À JOUR,"Shattered Minds,  The Lust City,  The Wish,  Symphony of the Serpent,  A Foreign World"
2025-09-24,AJOUT DE JEU,Race of Life
2025-09-23,MISE À JOUR,Prince of Suburbia
2025-09-23,AJOUT DE JEU,"Don’t Tell Mom: I Fed My Stepsister,  Summer with Mia"
2025-09-22,MISE À JOUR,"Prince of Suburbia,  League of Domination,  Bible Black -La Noche de Walpurgis- Ren'Py Remake,  Horny Hill"
2025-09-22,AJOUT DE JEU,The Assistant
2025-09-21,MISE À JOUR,"Last Man,  World of Secrets,  World of Sisters,  BizzareHolyLand"
2025-09-20,MISE À JOUR,"Hail Dicktator,  Naruto: Kunoichi Trainer,  Cursed Forest Quest,  Straitened Times,  Horton Bay Stories - Jake"
2025-09-19,MISE À JOUR,"Attack on Survey Corps,  Regret Island,  Two Faceless Adventures,  Multiverse Ballance,  Censored for Betas,  Paradise Lust 2"
2025-09-18,MISE À JOUR,"Heritage,  Wishes"
2025-09-17,AJOUT DE JEU,"Re:Rudy,  Fates Collide"
2025-09-16,MISE À JOUR,"Desert Stalker,  Claire's Quest,  Misanthropy,  Live in Corruption,  Wicked Warlocks"
2025-09-15,MISE À JOUR,SlutCraft: Heat of the Sperm
2025-09-15,AJOUT DE JEU,"DreamLink,  Valenza Family,  STWA: Unbroken,  Tune in to the Show"
2025-09-14,AJOUT DE JEU,Suffer to Please
2025-09-14,MISE À JOUR,"Nudist College,  The King of Summer,  Succubus Contract II,  Grandma's House"
2025-09-13,MISE À JOUR,"Boundaries of Morality,  Sword Art Online: The Trap of Breath Concealed Magic,  Renryuu: Ascension,  Crystal Desires,  New Beginnings in Japan,  ChariKiss"
2025-09-12,MISE À JOUR,"College Kings act 1,  Park after Dark,  Straitened Times,  Going Over,  Project Myriam - Life and Explorations,  Lust Academy,  LittleMan Remake"
2025-09-12,AJOUT DE JEU,Shadows of the Past
2025-09-11,MISE À JOUR,"Naruto: Family Vacation,  Hey Phil,  Locked in Chastity,  Family Mysteries,  AuntMan,  Bubbles and Babes,  Alternate Existence,  Star Periphery,  Single Again,  In for a Penny"
2025-09-11,AJOUT DE JEU,XS Crossing Fate
2025-09-10,AJOUT DE JEU,"Lust Element,  Edge of the Sky"
2025-09-10,MISE À JOUR,"Another Chance,  Isekai Paradise,  Dimitrescu's Trial,  Creepy House,  High School Master"
2025-09-09,MISE À JOUR,"Bible Black -La Noche de Walpurgis- Ren'Py Remake,  Persona 4: Rise Gaiden,  The Shadow over Blackmore,  The Fall of Galadriel,  Secrets of the Family,  SandStorm (EraStorm Saga #1),  Peasant's Quest,  Attack on Survey Corps,  Straitened Times,  Monster Girl 1,000,  Sword Art Online: The Trap of Breath Concealed Magic,  Camp Pinewood Remix,  Surrendering to My Crush,  The Awakening,  Troubled Legacy,  Special Request: In the Web of Corruption (Kinetic Edition),  Special Request: In the Web of Corruption,  SnowStorm"
2025-09-09,AJOUT DE JEU,Crystal Desires
2025-09-08,MISE À JOUR,"Ravager,  Sex Coach: Hot Yoga,  Stuck in My Game,  Hokage's Life,  Instinct Unleashed"
2025-09-08,AJOUT DE JEU,"Passioners,  Four Elements Trainer,  Kana Sensei"
2025-09-07,MISE À JOUR,"Futa Inn,  Guilty Pleasure,  Her Desire"
2025-09-07,AJOUT DE JEU,Once Again
2025-09-06,MISE À JOUR,"Last Man,  Grandma's House,  Peerless Lust"
2025-09-06,AJOUT DE JEU,Broken Promises
2025-09-05,MISE À JOUR,"Big Brother Ultimate,  Symphony of the Serpent,  Parasite Black,  The Cure for Madness"
2025-09-04,MISE À JOUR,"It Was Raining That Night,  Cabin Cruise,  Hooked!,  House Chores,  Shelly's Future Past,  Academy34"
2025-09-04,AJOUT DE JEU,Blood Spirals
2025-09-03,MISE À JOUR,"One Shot,  College Kings act 1"
2025-09-02,MISE À JOUR,"Futa Dominium,  Nephilim,  Multiverse Ballance,  Regret Island,  Trouble iN The aRena,  Mutant College,  Special Harem Class"
2025-09-02,AJOUT DE JEU,"The Nexus,  My True Desire,  A Foreign World,  Eldoria,  Dawnfall"
2025-09-01,MISE À JOUR,"Mind Control,  Ravager,  Spirit Lover,  My Best Deal,  Surrendering to My Crush,  Going for Goal"
2025-08-31,MISE À JOUR,"B.E.S.T,  Victoria in Big City (trad images en cours),  Welcome to Erosland,  Eternum,  Masters of the Island"
2025-08-31,AJOUT DE JEU,"FemCity,  Succubus Trick: Grown Up Problem,  Leviathan,  Heliorise"
2025-08-30,MISE À JOUR,"Mind Control,  Whispers of Desire,  The King of Summer,  Price of Power"
2025-08-29,MISE À JOUR,"Mind Control,  Bright Lord,  Horton Bay Stories - Jake"
2025-08-28,MISE À JOUR,"Attack on Survey Corps,  World of Sisters,  Futadom World - Binding Sim,  Normal Life under Feet,  Futa Family,  Heart Problems"
2025-08-28,AJOUT DE JEU,"Crossing the Lines,  Censored for Betas"
2025-08-27,MISE À JOUR,"The Simpsons Dating Sim,  Live in Corruption,  Star Periphery,  Fetish Locator: S&M Studio,  Becoming a Femboy,  Way of Corruption"
2025-08-27,AJOUT DE JEU,Lisa
2025-08-26,MISE À JOUR,"Ariana’s Perverted Diary,  Being Super,  My New Neighbors,  Back to the Past,  Empress Game,  Ravenous,  After That Night,  Bad Memories"
2025-08-25,MISE À JOUR,MILFs of Sunville
2025-08-25,AJOUT DE JEU,MILF Mansion
2025-08-24,MISE À JOUR,"The Wish,  Bible Black -La Noche de Walpurgis- Ren'Py Remake"
2025-08-24,AJOUT DE JEU,"An Evening of Wonders,  Deenus,  Color of My Sound,  Unrelenting Love,  Trouble at Home"
2025-08-23,MISE À JOUR,"Hail Dicktator,  Merging of the Stars,  MILFs of Sunville,  Mind Control,  Sex Gods,  Renryuu: Ascension,  Hornycraft"
2025-08-23,AJOUT DE JEU,Sono Hanabira ni Kuchizuke wo: A Kiss For The Petals 1
2025-08-22,MISE À JOUR,"Mind Control,  Realm Invader,  Dimitrescu's Trial"
2025-08-21,MISE À JOUR,Corruption Town
2025-08-20,MISE À JOUR,"Big Brother: Another Story Rebuild,  Regret Island"
2025-08-20,AJOUT DE JEU,"The East Block,  Horny Hill"
2025-08-19,MISE À JOUR,"Amnesia,  Radiant"
2025-08-19,AJOUT DE JEU,A Soldier's Struggle
2025-08-18,AJOUT DE JEU,"Monstrous Liberation,  My Dorm"
2025-08-18,MISE À JOUR,Barely Working
2025-08-16,AJOUT DE JEU,Pandora's Box 2
2025-08-16,MISE À JOUR,Regret Island
2025-08-15,MISE À JOUR,"Escape from Ivy and Piper,  Our Red String"
2025-08-14,MISE À JOUR,"Escape from Ivy and Piper,  Renryuu: Ascension,  Lara Croft and the Lost City,  Realm Invader"
2025-08-14,AJOUT DE JEU,Futaisekai - A Tale of Unintended Fate
2025-08-13,MISE À JOUR,Steam Halloween Side Story]
2025-08-12,MISE À JOUR,"Devoted Wife,  True Husband,  Wicked Warlocks,  The Simpsons Dating Sim,  Lab Rats 2 - Reformulate,  Camp Pinewood Remix,  Lucky Paradox"
2025-08-12,AJOUT DE JEU,"Don't Leave My Side,  New Beginnings in Japan,  Oppaicafe: My Mother, My Sister, and Me"
2025-08-11,AJOUT DE JEU,"Artifice,  The Mind Society,  Lucky Paradox,  Lab Rats 2 - Reformulate"
2025-08-11,MISE À JOUR,"In for a Penny,  Straitened Times,  Word of Mouth"
2025-08-10,MISE À JOUR,"Chasing Sunsets,  LittleMan Remake,  The Fiery Scion part 3,  Being Super,  A Wife and Mother Fan Game,  Bible Black -La Noche de Walpurgis- Ren'Py Remake"
2025-08-10,AJOUT DE JEU,"Bound by Blood,  Tales of Terrara"
2025-08-09,AJOUT DE JEU,"Her Gentle Hands on You,  Spicier than Sugar,  RWBY Rise Of The White Fang,  Oh, Yes! Kasshoku Bitch Hitozuma no Seiyoku Kaishou ~Ero Ero Dekiru Mama-san Volley Kai~,  Seeds of Chaos"
2025-08-09,MISE À JOUR,"Lewd Invasion,  Sword Art Online: The Trap of Breath Concealed Magic,  Renryuu: Ascension,  Regret Island"
2025-08-08,MISE À JOUR,"Milfania,  Angel & Demon,  Couples,  Nephilim,  Multiverse Ballance,  The Red Threads,  Surrendering to My Crush,  Bible Black -La Noche de Walpurgis- Ren'Py Remake,  Wet Nightmares"
2025-08-07,MISE À JOUR,"Boundaries of Morality,  Being Super"
2025-08-06,MISE À JOUR,"How to Fuck in a Zombie Apocalypse?,  Instinct Unleashed"
2025-08-05,MISE À JOUR,"Our Home,  ALT CTRL DEL,  Academy34,  Away from Home,  Bubbles and Sisters,  Cabin Cruise,  Hard to Love,  Martique's Farm,  Shelly's Future Past,  How I Became a Hero,  A.I.D.A,  Facefuck Madness Reloaded,  Summertime Saga,  How to Raise a Happy NEET"
2025-08-04,MISE À JOUR,"Ravager,  Inner Growth,  World of Sisters"
2025-08-04,AJOUT DE JEU,Altered Destiny
2025-08-02,MISE À JOUR,"Last Man,  Sophie: The Girl from the Zone ,  Halfway House,  Anna Exciting Affection,  Simple Days,  Peerless Lust"
2025-07-31,AJOUT DE JEU,"A Touch of Magic,  Dreamland,  No More Money,  Public Sex Life H,  Industry Baby,  Profiler,  Corrupted Kingdoms"
2025-07-31,MISE À JOUR,Sicae
2025-07-30,MISE À JOUR,"Summer of Shame,  Grandma's House,  FutaOS,  Milfylicious,  My Bully Is My Lover,  LittleMan Remake,  Anna Exciting Affection,  The Necromancer Arises,  A Wife and Mother Fan Game,  The Last Star Walker"
2025-07-30,AJOUT DE JEU,White Cube
2025-07-29,MISE À JOUR,"Lyndaria: Lust Adventure,  The Fall of Galadriel,  Cursed Forest Quest,  Photo Hunt"
2025-07-28,MISE À JOUR,Burning Boundaries
2025-07-27,MISE À JOUR,"Single Mother,  Sara - Oh Daddy Part 2"
2025-07-27,AJOUT DE JEU,"Braveheart Academy,  Braveheart Academy 2"
2025-07-26,MISE À JOUR,"Hail Dicktator,  Cybernetic Seduction,  The King of Summer,  Another Chance,  Straitened Times,  Oppai Odyssey,  Guilty Pleasure,  Bastard Chronicles: The Shipwreck,  Ravenous,  Jennifer's Life"
2025-07-25,MISE À JOUR,Corrupted Paradise
2025-07-25,AJOUT DE JEU,"Law School,  Call of Nature"
2025-07-24,MISE À JOUR,"FreshWomen,  Immoral Stories Rebecca,  Horton Bay Stories - Jake,  In for a Penny,  Tamara Exposed,  The Fiery Scion,  Myth of Slayer,  Ripples"
2025-07-24,AJOUT DE JEU,"University Days,  DropOut Saga,  Special Harem Class,  High Desire"
2025-07-23,MISE À JOUR,"The Wish,  LittleMan Remake"
2025-07-23,AJOUT DE JEU,"Secrets and Promises,  Company Ink,  Succubus Contract II"
2025-07-22,MISE À JOUR,Corruption Town
2025-07-22,AJOUT DE JEU,"Vae Victis - Khan: Conquer, Ravish, Breed"
2025-07-21,MISE À JOUR,"Persona 4: Rise Gaiden,  FreshWomen"
2025-07-20,AJOUT DE JEU,"Big Brother Ultimate,  Sex Dorm,  Mini Mia Game!,  Corrupted Key"
2025-07-19,MISE À JOUR,"Stuck in My Game,  Mystery of MILFs,  Misanthropy,  Shattered Minds,  Ariana’s Perverted Diary,  LittleMan Remake,  Immoral Stories Rebecca,  Peerless Lust"
2025-07-19,AJOUT DE JEU,"Wild Cats,  Projekt: Passion"
2025-07-18,MISE À JOUR,"Regret Island,  Frieren and Fern in the Lewd Dungeon,  Ring of Lust,  Hokage's Life,  Straitened Times"
2025-07-17,MISE À JOUR,"Beauty and the Thug,  Attack on Survey Corps,  Dimitrescu's Trial,  Where It All Began"
2025-07-17,AJOUT DE JEU,"12 Goddesses,  Hero to Villain Remastered,  Fate/Squeeze Order,  The Inn,  Where It All Began (Uncut Taboo Edition)"
2025-07-16,MISE À JOUR,"Bored Wife ,  Grandma's House"
2025-07-16,AJOUT DE JEU,Whispers of Desire
2025-07-15,MISE À JOUR,"Demon Charmer,  Spirit Lover,  My Best Deal,  In for a Penny,  Family, Friends and Strangers"
2025-07-14,MISE À JOUR,"Bible Black -La Noche de Walpurgis- Ren'Py Remake,  Incest,  MILF Breeder"
2025-07-14,AJOUT DE JEU,"The Restaurant,  Mutant College,  A Shot in the Dark"
2025-07-13,AJOUT DE JEU,Between Humanity
