date_maj,type,jeux
2026-04-10,MISE À JOUR,"Worlds of Wonders,  Small Coffee,  Four Elements Trainer,  Succubless"
2026-04-10,AJOUT DE JEU,Swarm Bunker: Lust Defense
2026-04-09,MISE À JOUR,"Bodysmith Tales: Hidden Legacy,  Hot Therapy,  University Days,  Imperial Bureaucracy Hero,  Another Chance,  Cartel Simulator,  My Early Life,  Spirit Lover,  Our Red String,  Nephilim,  Regret Island,  LockDown Dom,  Jikage Rising,  Deep Vault 69,  The Intoxicating Flavor,  The Pilgrimage (Chapter 2),  Accord"
2026-04-09,AJOUT DE JEU,"Lukestria Family,  Lessons of love and lust,  Jen's Dilemma,  Butthole Tattoo Artist Simulator"
2026-04-08,MISE À JOUR,ReConnect: TextingStories
2026-04-07,AJOUT DE JEU,"Lara Croft and the Lost City,  Maleficent: Banishment of Evil"
2026-04-07,MISE À JOUR,"FreshWomen,  Harem Fantasy"
2026-04-06,MISE À JOUR,"My Pig Princess,  My Netorase Obsession,  Discipline -The record of a Crusade- Ren'Py Remake,  Hornycraft,  Braveheart Academy 2,  Viral Rivalz,  White Boy Summer,  Sorceress In the Sinful Silkwood Yielding"
2026-04-06,AJOUT DE JEU,"Simplicity,  Cursed Affection,  Magic Academy,  Your RWBY Fantasy,  OSC The Lust of Us,  Dragon Ball F,  Demon Boy Saga"
2026-04-05,MISE À JOUR,"Apocalypse Lovers,  World of Sisters,  New Beginnings in Japan,  Summer's Gone (Uncut Taboo Edition)"
2026-04-05,AJOUT DE JEU,"Red Sakura Mansion 2,  The Home of Pleasure,  Champion of Realms,  Twinewood"
2026-04-04,MISE À JOUR,"How to Fuck in a Zombie Apocalypse?,  My Bimbo Dream: Kingpin,  The Shadow over Blackmore,  Origin Story,  Orange Smash"
2026-04-04,AJOUT DE JEU,"Double Perception,  Date a Giantess,  Origin Story"
2026-04-03,AJOUT DE JEU,"Throbbin Hood,  30 Days,  Astral Bordello,  Becky's Reckoning,  Bobby's Memoirs of Depravity,  IRYS"
2026-04-03,MISE À JOUR,"ERASTORM ~ SnowStorm,  Total Maidness!,  Futaisekai - A Tale of Unintended Fate,  Him"
2026-04-02,MISE À JOUR,"Chastity Falls,  Click-Her,  Summertime Saga,  Academy34,  Pandora's Box 2,  Camp Pinewood Remix,  Jury,  Mutual Corruption,  Special Harem Class,  The Beautiful Game"
2026-04-02,AJOUT DE JEU,"Mounting Olympus,  Bubble Milf,  Melatonin Magiks,  Wartribe Academy,  Between Duty and Love,  Tribulations of a Mage"
2026-04-01,MISE À JOUR,"Goodbye Eternity,  Shattered Minds,  A.I.D.A,  Away from Home,  Facefuck Madness Reloaded,  Invulnerable,  Lustworth Academy,  Succubus Dance,  Single Again,  Simple Days,  Being Super,  Love, Honor, Betray,  In for a Penny,  Grandma's House,  The Wants of Summer,  Sword Art Online: The Trap of Breath Concealed Magic,  Dark Enthrall,  Guilty Pleasure,  Her Desire"
2026-04-01,AJOUT DE JEU,Dark Enthrall
2026-03-31,MISE À JOUR,"Ravager,  Lewd Invasion,  Survivor Strain,  Divine Heel,  Secrets and Promises"
2026-03-31,AJOUT DE JEU,"ERASTORM ~ SnowStorm,  Snapshot: Lewd Shores,  Debtors,  Honeymoon Island,  Memories,  From the Eclipse"
2026-03-30,MISE À JOUR,"Beauty and the Thug,  Once a Porn a Time,  From the Eclipse,  We Need Money"
2026-03-30,AJOUT DE JEU,"From the Eclipse,  ChariKiss"
2026-03-29,MISE À JOUR,"Innocent Witches,  Lust Brawl,  Dark Magic"
2026-03-29,AJOUT DE JEU,"Our Life: Now & Forever,  My Cousin´s Bride,  Not a Succubus"
2026-03-28,MISE À JOUR,"Tenebris Legion,  Over the Moon,  My Naughty Daughter,  Midnight Sin,  Cybernetic Seduction,  Renryuu: Ascension"
2026-03-28,AJOUT DE JEU,New Life with My Daughter
2026-03-27,MISE À JOUR,"Alice's Descent,  House Party,  Love at Work,  Camp Pinewood Remix,  Attack on Survey Corps,  FreshWomen,  Isekai Awakening"
2026-03-27,AJOUT DE JEU,"Snapshot: Naughty Nightmares,  Katalist"
2026-03-26,MISE À JOUR,"Growing Things Up,  Mind Control"
2026-03-26,AJOUT DE JEU,Course to Venus!
2026-03-25,MISE À JOUR,"Regret Island,  Angel's Love,  Dreamer Life,  Frieren and Fern in the Lewd Dungeon,  Shroud,  University of Problems"
2026-03-25,AJOUT DE JEU,"Whispers of Desire,  Better Future,  My Early Life,  Kelly's Family : Mother in law REMAKE"
2026-03-24,MISE À JOUR,"Boundaries of Morality,  Harem Fantasy,  Naruto: Shinobi Lord,  Big Brother Ultimate,  Medschool, Love and Friends"
2026-03-24,AJOUT DE JEU,One Night With Caroline
2026-03-23,MISE À JOUR,"Snapshot!,  Occultus: The Craving,  Discipline -The record of a Crusade- Ren'Py Remake,  Straitened Times,  Live to Fight"
2026-03-23,AJOUT DE JEU,"Memories with You,  Sin Island"
2026-03-21,MISE À JOUR,"Hail Dicktator,  My Naughty Daughter,  Alternate Existence,  Cabin Cruise,  Becoming a Femboy,  Celina's Calling,  Jikage Rising,  Naughty Neighbours,  Sex Gods,  Horton Bay Stories - Jake"
2026-03-21,AJOUT DE JEU,"The Island of Milfs,  Elena's Story"
2026-03-20,MISE À JOUR,"The Wish,  Nympho Tamer,  Crossing the Lines"
2026-03-20,AJOUT DE JEU,"Strip Crazy Eights,  Alice's Descent,  The Secret of Mom and Me: Remake,  Mutual Corruption,  Femdom First Timers,  Hero in Training"
2026-03-19,AJOUT DE JEU,"My Hypnotized Family,  Evermore,  Something's in the Air,  Date Ariane,  Planet StrongHold"
2026-03-19,MISE À JOUR,Holdcraft Chronicles: Aki
2026-03-18,MISE À JOUR,"Click-Her,  House Party,  Devoted Wife,  The Builder"
2026-03-18,AJOUT DE JEU,"Lust Manor: Leona’s Secret,  The Memory Machine,  Incest,  The Matriarch"
2026-03-17,MISE À JOUR,"White Boy Summer,  Little Regina,  Symphony of the Serpent,  Barely Working,  Snapshot!,  Sinful Vampires,  Sexbot II: Recalibrated,  MILF Games,  The Fall of Galadriel,  Vae Victis - Khan: Conquer, Ravish, Breed"
2026-03-17,AJOUT DE JEU,"Sorceress In the Sinful Silkwood Yielding,  League of Domination"
2026-03-16,MISE À JOUR,"MILF's Plaza,  Stuck in My Game,  Jason, Coming of Age,  World of Secrets,  Living with Temptation: American sunset EXPANSION 3,  The Simpsons Dating Sim,  Jennifer's Life,  DickmonX Remake"
2026-03-16,AJOUT DE JEU,My Bimbo Dream: Kingpin
2026-03-15,MISE À JOUR,"Snapshot!,  Zero to Harem Hero: A Hentai Isekai Adventure,  Streaming for Love,  If I Could Change"
2026-03-15,AJOUT DE JEU,"Black Bear Creek,  House of Lolitas,  Anthems of the Nightside"
2026-03-14,MISE À JOUR,"Snapshot!,  Anna Exciting Affection,  Project Myriam - Life and Explorations,  Going Over,  Cursed Forest Quest,  How I Became a Hero,  Claire's Quest,  In for a Penny,  Wishes"
2026-03-14,AJOUT DE JEU,Maya's Mission
2026-03-13,MISE À JOUR,"Creepy House,  Dimitrescu's Trial,  Grandma's House"
2026-03-12,MISE À JOUR,"Cosmic Desires,  SlutCraft: Heat of the Sperm,  MILF Games"
2026-03-12,AJOUT DE JEU,"NTR Isekai,  Touch of Y,  LockDown Dom,  Punk 2079,  Slice of Venture Remake,  Smallwood,  Under the Same Roof"
2026-03-11,MISE À JOUR,"Agent17,  Unexpected Consequences,  Living with Temptation: American sunset EXPANSION 3,  Welcome to Wimblewick,  FEMBOY HOTEL,  Peasant's Quest,  Spirit Lover,  Cross Realms"
2026-03-11,AJOUT DE JEU,"Cosmic Desires,  Bitchy Boss Bimbofication ,  Hypnosis Experiment"
2026-03-10,MISE À JOUR,"Tales from the Unending Void,  Growing Things Up,  Attack on Survey Corps,  Becoming a Femboy,  Alternate Existence,  Academy34,  Cabin Cruise,  Shelly's Future Past,  Blacked House,  Succubus Dance,  Whores of Thrones,  Living with Vicky"
2026-03-10,AJOUT DE JEU,"Jail College,  Living with Temptation: American Sunset"
2026-03-09,MISE À JOUR,"Tales from the Unending Void,  Town of Magic,  Regret Island"
2026-03-08,MISE À JOUR,"Naruto: Kunoichi Trainer,  First Change,  Peerless Lust,  LittleMan Remake,  World Tamer,  Nephilim,  Discipline -The record of a Crusade- Ren'Py Remake,  Back to the Past"
2026-03-08,AJOUT DE JEU,"My Girlfriend & My Futa Grandma 2,  My Girlfriend & My Futa Grandma,  Voreocracy,  ATM Adventures,  Sandy Bay"
2026-03-07,MISE À JOUR,"Last Man,  Love at Work,  Game of Hearts,  Amnesia,  Milfylicious,  The Singer,  Tamara Exposed,  My Best Deal,  Futa Family,  Horny Hill"
2026-03-07,AJOUT DE JEU,"Baking With Chocolate,  Succubless"
2026-03-06,AJOUT DE JEU,"My Roommate is a cute Ghost Girl!?,  Idol Forging,  Isekai Sex Kingdom,  SQUAD XXX: Slut Hunt"
2026-03-06,MISE À JOUR,"Snapshot!,  The Roommate"
2026-03-05,AJOUT DE JEU,"Futadom World: Binding Sim,  SEX Guild Simulator,  From Aristocrat's Pet to Culinary Queen"
2026-03-05,MISE À JOUR,"Altered Destiny,  Another Chance"
2026-03-04,MISE À JOUR,"Click-Her,  How to Fuck in a Zombie Apocalypse?,  Going Over,  Renryuu: Ascension,  The Lost Love,  Milfylicious"
2026-03-03,MISE À JOUR,"Harem Fantasy,  Yuri University,  Lucky Paradox,  College of Mysteria,  Personal Trainer"
2026-03-03,AJOUT DE JEU,"Demon Boy,  Midlife Crisis"
2026-03-02,MISE À JOUR,"Chastity Falls,  After The Fog,  Persona 4: Rise Gaiden,  Game of Whores"
2026-03-02,AJOUT DE JEU,EmyLiveShow Origins: Emy the Vampire Queen
2026-03-01,MISE À JOUR,"Big Brother: Another Story Rebuild,  FutaOS,  Sara - Oh Daddy Part 2,  Girlfriend"
2026-03-01,AJOUT DE JEU,"After The Fog,  MMA Life Simulator"
2026-02-28,AJOUT DE JEU,"Spellbound Beauties,  Distant Shores. Saga,  Taboo University,  Futa Healthcare"
2026-02-28,MISE À JOUR,"Isekai Awakening,  Midnight Sin,  World of Sisters,  Bubbles and Babes,  Celina's Calling,  Invulnerable,  Way of Corruption,  The Fall of Galadriel,  Vae Victis - Khan: Conquer, Ravish, Breed,  Viral Rivalz,  Surviving My Family"
2026-02-27,MISE À JOUR,"True Husband,  Apocalypse Lovers,  Deep Vault 69,  Driven Affairs,  Lustfield,  Renryuu: Ascension,  Parasite Black"
2026-02-27,AJOUT DE JEU,"Medschool, Love and Friends,  She Is My Precious,  The Dollsville Upgrade,  Goddesses' Whim"
2026-02-26,MISE À JOUR,"My Bimbo Dream,  Apocalypse Lovers,  Blacked House"
2026-02-26,AJOUT DE JEU,"The Price of Flesh,  Stolen Destiny,  HS Tutor"
2026-02-25,MISE À JOUR,"Agent17,  Big Brother Ultimate,  CelSector,  My Bimbo Dream,  Chemical Curvers Clicker,  Guilty Pleasure"
2026-02-25,AJOUT DE JEU,"Acceptance,  SPACE PRISON,  Pain and Pleasure,  ReConnect: TextingStories,  Dreams of Desire Holiday Special,  My Ass Pass to Succubus Sexland!"
2026-02-24,MISE À JOUR,"Snapshot!,  Apocalypse Lovers,  Rise or Fall,  Attempted Redemption,  Academy of the Elite,  Naughty Neighbours,  Spirit Lover,  The Wants of Summer"
2026-02-24,AJOUT DE JEU,"Demon Charmer,  Mate on Titan"
2026-02-23,MISE À JOUR,"My Bimbo Dream,  Pandora's Box 2,  Photo Hunt,  Shadow Island,  Dimitrescu's Trial,  The Stallion,  White Boy Summer"
2026-02-23,AJOUT DE JEU,"The Fallen of Angel,  Go!Go!PizzaBoy!,  Lust Village"
2026-02-22,MISE À JOUR,"Barely Working,  Sisterly Lust,  Above the Clouds,  House of Hearts,  The Restaurant,  Horton Bay Stories - Jake,  LittleMan Remake,  Harvesting Corruption,  Discipline -The record of a Crusade- Ren'Py Remake,  Heritage,  Simulation 69,  The Fiery Scion,  Orange Smash,  Dimitrescu's Lewd Castle,  Welcome to Erosland"
2026-02-22,AJOUT DE JEU,"Surrendering to My Crush,  Snapshot!,  Sovereign,  Occultus: The Craving,  Konoha Milfs,  If I Could Change,  Rengoku No Muma"
2026-02-21,MISE À JOUR,"Click-Her,  Hail Dicktator,  The Wish,  Lust Brawl"
2026-02-20,MISE À JOUR,"Agent17,  Symphony of the Serpent,  Streaming for Love,  New Horizon"
2026-02-20,AJOUT DE JEU,"Fate/Empire of Dirt,  Naughty Neighbours,  Actual Roommates Gaiden: The Woman Who Lost Her Cat,  Dark Prodigy Simulator,  Lost & Found,  Harem Corruption,  Imperial Chronicles"
2026-02-19,AJOUT DE JEU,"Milf's Villa Unofficial Ren'py Ports,  Apostate Verity,  Love at Work"
2026-02-19,MISE À JOUR,Regret Island
2026-02-18,MISE À JOUR,"Click-Her,  Ludus Master,  Divine Heel,  Takei's Journey,  Quarantine Libido,  Finding Cloud 9,  Broken Hearts Still Want to Love,  Little Regina,  Girlfriend,  We Need Money,  Victoria in Big City"
2026-02-18,AJOUT DE JEU,"Manga Club Advisor wants to support Saeki Sasara,  Plowed,  Summer Crush,  Come Home,  Due to My New Situation, I Have to Corrupt My Friend's Harem!,  Isolation Project,  Lust City,  Lyla's Curse,  Milfvania,  My Neighbor Looks Just Like Elasti Girl!"
2026-02-17,MISE À JOUR,"House Party,  Shadow Island"
2026-02-16,MISE À JOUR,"Agent17,  My Dorm,  Harem Fantasy,  Reunion"
2026-02-16,AJOUT DE JEU,"Missy: The Rise of Poppy,  Lustful Desires"
2026-02-15,MISE À JOUR,"Harem Fantasy,  Town of Magic,  Tamara Exposed,  Grandma's House,  Shackles of Ellswyn,  Sakura Gozen"
2026-02-15,AJOUT DE JEU,Lewd Life with my Doggy Wife
2026-02-14,MISE À JOUR,"Astra: Ardent Show,  Bodysmith Tales: Hidden Legacy,  FreshWomen,  High School Master,  Love & Sex Second Base"
2026-02-14,AJOUT DE JEU,"Nightlife,  WANTED: Wild Sluts"
2026-02-13,MISE À JOUR,"MILFs of Sunville,  University Days,  Being Super,  Isekai Awakening,  Bible Black -La Noche de Walpurgis- Ren'Py Remake,  Hokage's Life,  In for a Penny,  Succubus Trick: Grown Up Problem"
2026-02-13,AJOUT DE JEU,"Succubus Dance,  Lustworth Academy,  Bright Past,  Jikage Rising,  BBS2,  Agent Horny"
2026-02-12,MISE À JOUR,"Devoted Wife,  DickmonX Remake,  Mystery of MILFs,  Misanthropy,  Two Faceless Adventures,  Shattered Minds,  Crossing the Lines"
2026-02-12,AJOUT DE JEU,The Mating Season
2026-02-11,MISE À JOUR,"Origin Story,  Fleeting Memories,  Shelly's Future Past,  Love and Temptation"
2026-02-10,MISE À JOUR,The Last Embrace
2026-02-10,AJOUT DE JEU,"Anita's Internship,  Back for Revenge,  Forbidden Dungeon,  In The Shadows  Of Ashwood,  JL: Next Generation"
2026-02-09,MISE À JOUR,"Boundaries of Morality,  The Wants of Summer"
2026-02-08,MISE À JOUR,"Inanna Revenge,  Unexpected Consequences,  Lucky Paradox,  How to Fuck in a Zombie Apocalypse?,  Milfania,  Discipline -The record of a Crusade- Ren'Py Remake"
2026-02-07,MISE À JOUR,"Symphony of the Serpent,  Aurora Protocol,  Zero to Harem Hero: A Hentai Isekai Adventure"
2026-02-07,AJOUT DE JEU,Lucky Bastard
2026-02-06,MISE À JOUR,"Last Man,  Tenebris Legion,  Star Periphery,  Dimitrescu's Trial,  Sword Art Online: The Trap of Breath Concealed Magic"
2026-02-06,AJOUT DE JEU,"Ariana's Dark Christmas 2,  Adored by the Devil,  Celina's Calling,  Violation Nation,  So Much to Love"
2026-02-05,MISE À JOUR,"Regret Island,  Monster Girl 1,000,  Four Elements Trainer,  Naruto: Shinobi Lord,  Discipline -The record of a Crusade- Ren'Py Remake"
2026-02-05,AJOUT DE JEU,The Stallion
2026-02-04,MISE À JOUR,"Click-Her,  Pale Carnations"
2026-02-03,MISE À JOUR,"CelSector,  Goodbye Eternity,  The Seven Realms,  White Boy Summer"
2026-02-03,AJOUT DE JEU,"My Girl Loves Handcuffs,  Aihvala,  Karlsson's Gambit"
2026-02-02,MISE À JOUR,"New Family,  Etlina's Principle,  Last Human,  Summertime Saga,  Fetish Locator: S&M Studio"
2026-02-02,AJOUT DE JEU,"Furtown: New Beginnings,  Single Mother,  My Bully Is My Lover - Semi Auto"
2026-02-01,MISE À JOUR,"Attack on Survey Corps,  Horton Bay Stories - Jake,  Milfylicious"
2026-02-01,AJOUT DE JEU,Chastity Falls
2026-01-31,MISE À JOUR,"Midnight Sin,  The Last Embrace,  Burning Boundaries"
2026-01-31,AJOUT DE JEU,"Grandma's House,  The Gain Trials"
2026-01-30,MISE À JOUR,"Academy34,  Max's Life,  Driven by Desire"
2026-01-30,AJOUT DE JEU,"Bulmas Balls: The Game,  Chemical Curvers Clicker,  Super Slut Z Tournament,  Super Slut Z Tournament 2,  Summer Scent,  Max's Life,  Daily Lives of My Countryside,  Leaving DNA,  On the Prairie"
2026-01-29,MISE À JOUR,"Ring of Lust,  Pandora's Box 2,  Nephilim,  Isekai Awakening,  Mutant College"
2026-01-29,AJOUT DE JEU,"Ring of Lust,  Hope I Get a Happy Ending,  Lana and the Milking Table,  Futa Family"
2026-01-28,MISE À JOUR,"World Tamer,  Amnesia,  Adventurer Trainer,  Two Faceless Adventures,  My Bully Is My Lover,  Oppai Odyssey,  Wishes,  Simple Days,  Resident X,  Ravenous,  Mother NTR Training,  Bastard Chronicles: The Shipwreck,  The Simpsons Dating Sim"
2026-01-28,AJOUT DE JEU,"Mini Mia Game!,  STELLAR INC - Internship"
2026-01-27,MISE À JOUR,"The Last Embrace,  Total Maidness!"
2026-01-26,MISE À JOUR,"Fate/Stray Night,  Adventurer Trainer,  Renryuu: Ascension,  Deep Vault 69,  Guilty Pleasure"
2026-01-26,AJOUT DE JEU,"The Gain Trials,  Lust Unleashed: A Special Lady Part Four,  MILF Games,  Three and One: The Cursed Mansion,  Urban Demons: Remake,  The Lust Voyage,  My Pleasure,  Him,  Fattening Career"
2026-01-25,MISE À JOUR,"Inanna Revenge,  Lockdown 2024,  DickmonX Remake,  ConnaiSSance - Getting Close To My Cousin"
2026-01-25,AJOUT DE JEU,"No Nut November: A Futa Awakened,  Love Dolls,  Total Maidness!"
2026-01-24,MISE À JOUR,"Hail Dicktator,  Our Home,  My Best Deal,  Sex Gods,  Total Maidness!,  Restore Her Career"
2026-01-24,AJOUT DE JEU,"Total Maidness!,  Eden,  Doll Verse,  My Dress Up NTR: Unseen Desire,  Star Mars,  Horny Jail,  The Chastity Scholarship,  CelSector"
2026-01-23,MISE À JOUR,"Whispers of Desire,  First Change,  We Need Money"
2026-01-23,AJOUT DE JEU,"Lust Trip,  Creature Get!,  Wasteland Guardians"
2026-01-22,AJOUT DE JEU,"My BBW Girlfriend,  Four Girlfriends,  My Naughty Daughter,  Student Bodies,  Click-Her"
2026-01-22,MISE À JOUR,"FEMBOY HOTEL,  Eternum"
2026-01-21,MISE À JOUR,"Between Humanity,  Sunrise City,  Cursed Forest Quest,  Multiverse Ballance,  Waifu Academy,  Long Road Home,  Finding Cloud 9"
2026-01-21,AJOUT DE JEU,"Stellar Dream,  Where the Heart Is"
2026-01-20,MISE À JOUR,"Crime Lawn Repeat,  MILFs of Sunville,  Summer with Mia,  Regret Island,  Little Regina,  Symphony of the Serpent,  A Day at the Spa"
2026-01-20,AJOUT DE JEU,"Give Me a Sun,  The Legend of the Goblins,  Little Regina,  Futanari College ,  Christa & Tonyo,  Adventures in Heartbrook Town"
2026-01-19,MISE À JOUR,"A Touch of Magic,  Crime Lawn Repeat,  Eternum,  Streaming for Love,  Castle Darkstone,  Peerless Lust,  Saving Paula"
2026-01-19,AJOUT DE JEU,"My Bully Is My Lover,  Bimbo Virus,  Gamer Girl Adventure"
2026-01-18,AJOUT DE JEU,"Dimitrescu's Lewd Castle,  Dimitrescu's Trial,  The Lost Love,  Valhalla: Lilith Rising"
2026-01-18,MISE À JOUR,"Persona 4: Rise Gaiden,  Law School,  Broken Promises,  Grandma's House,  Milfania,  Mila AI"
2026-01-17,MISE À JOUR,"University Days,  Inanna Revenge,  After That Night"
2026-01-17,AJOUT DE JEU,"Pussy Mechanic,  Lust Brawl,  Hornycraft"
2026-01-16,MISE À JOUR,"Harmony Girls,  Gynocracy,  Lewd Invasion"
2026-01-16,AJOUT DE JEU,"My College Memories,  The Rural Homecoming 2"
2026-01-15,AJOUT DE JEU,"KonoSuba - The Harem Adventures,  Adventurer Trainer,  Bodysmith Tales: Hidden Legacy,  Overlord H,  Fate/Stray Night,  The Shadow over Blackmore,  Universal Garbage Station"
2026-01-15,MISE À JOUR,"Rovering to Sussex,  Secrets and Promises"
2026-01-14,MISE À JOUR,"Corruption Town,  Isekai Awakening"
2026-01-14,AJOUT DE JEU,"Far Star,  Paradise City,  Aihvala"
2026-01-13,MISE À JOUR,"Barely Working,  World Tamer,  Life's Payback,  Companion of Darkness,  Dawnfall,  Isekai Paradise,  Love & Sex Second Base,  Masters of the Island,  A House in the Rift,  Angel's Love,  Family Mysteries,  My Netorase Obsession,  Locked in Chastity"
2026-01-13,AJOUT DE JEU,"Isekai Awakening,  Bound by Lust,  Solvalley School,  Dark Magic,  The Nature of Magic,  What a Legend!,  Five Night at Lust,  The Last Challenge,  Seeds of Chaos,  Broke in Isekai,  The Adored Marriage,  Good Luke"
2026-01-12,MISE À JOUR,"Discipline -The record of a Crusade- Ren'Py Remake,  The Fixer,  Shelly's Future Past,  Harvesting Corruption,  Bible Black -La Noche de Walpurgis- Ren'Py Remake,  White Boy Summer,  Sword Art Online: The Trap of Breath Concealed Magic,  Reincarnated in Submission"
2026-01-12,AJOUT DE JEU,"Pandora's Box 2,  The Wild Boy,  Boring Life,  Inner Demons,  After the Inferno,  Sakura Gozen"
2026-01-11,MISE À JOUR,Devoted Wife
2026-01-10,MISE À JOUR,"Lily,  How to Fuck in a Zombie Apocalypse?,  Lost Solace,  Corrupted Love,  Zero to Harem Hero: A Hentai Isekai Adventure"
2026-01-10,AJOUT DE JEU,"The Rural Homecoming,  Our Red String"
2026-01-09,AJOUT DE JEU,"Arrival of the Goddess,  Four Elements Trainer Spookytimes,  Vampussy,  Four Elements Trainer"
2026-01-09,MISE À JOUR,"Attack on Survey Corps,  Renryuu: Ascension,  Project Myriam - Life and Explorations"
2026-01-08,MISE À JOUR,Aurora Protocol
2026-01-08,AJOUT DE JEU,Coming Up Short
2026-01-07,MISE À JOUR,"Stuck in My Game,  Futa Inn,  Shackles of Ellswyn,  My True Desire"
2026-01-06,MISE À JOUR,"Corruption Town,  Regret Island,  Crossing the Lines"
2026-01-06,AJOUT DE JEU,"Young Again - S1 Ch.14 Public,  Reincarnated in Submission"
2026-01-05,MISE À JOUR,"Symphony of the Serpent,  Empress Game,  Bastard Chronicles: The Shipwreck,  Pizza Hot!"
2026-01-05,AJOUT DE JEU,Seed My Wife
2026-01-04,MISE À JOUR,"Blended Family,  Heaven's Door"
2026-01-04,AJOUT DE JEU,"The Queen Who Adopted a Goblin,  Tales of Terrara,  Harvesting Corruption,  Fate and Life: The Mystery of Vaulinhorn,  Fate King,  Hen-Party,  I Am Her Pet,  Projekt Moon: Hope Awakens,  The Haunted Mansion"
2026-01-03,MISE À JOUR,"Corruption Town,  Last Man,  The Headmaster,  In for a Penny,  The Fiery Scion,  First Change"
2026-01-03,AJOUT DE JEU,"My A-rank Witch,  Hotwife Ashley,  The Trio,  First Dates After 50"
2026-01-02,MISE À JOUR,"Guilty Pleasure,  Grandma's House,  Her Desire,  Brooks in Wild West,  Shattered Minds,  Welcome to Erosland,  Immoral Stories Rebecca"
2026-01-01,MISE À JOUR,"Corruption Town,  Mind Control,  My Bimbo Dream,  Streaming for Love,  Mutant College,  Not Georgia"
2026-01-01,AJOUT DE JEU,Lucky Mark - Unofficial Ren'Py Port
2025-12-31,MISE À JOUR,"Corruption Town,  Academy34,  Pill King,  How I Became a Hero,  Horton Bay Stories - Jake,  LittleMan Remake"
2025-12-30,MISE À JOUR,"Attack on Survey Corps,  Pizza Hot!,  True Husband,  Living with Vicky,  Misanthropy,  Hey Phil"
2025-12-30,AJOUT DE JEU,"Sinful Summer: A Tale of Forbidden Love,  Spirit Lover,  Femdom University Zero,  Kaiju Princess"
2025-12-29,MISE À JOUR,"Away from Home,  Cabin Cruise,  Hard to Love,  The Fixer,  The Arson Betrayal"
2025-12-29,AJOUT DE JEU,"The Pilgrimage (Chapter 2),  Taboo University,  Once a Porn a Time,  Sword Art Online: The Trap of Breath Concealed Magic"
2025-12-28,MISE À JOUR,"A Touch of Magic,  Midnight Sin,  Town of Magic,  Discipline -The record of a Crusade- Ren'Py Remake,  Holly Smiles at the End"
2025-12-27,AJOUT DE JEU,"Chona,  NTR Family,  Life Is Isekai,  Life Is Isekai: The Stories,  Femdom Therapy,  Femdom Therapy: New Life,  Futa Groves,  DESIRIUM"
2025-12-27,MISE À JOUR,"We Need Money,  DickmonX Remake"
2025-12-26,MISE À JOUR,"Goodbye Eternity,  Ludus Master,  Secrets and Promises,  Big Brother Ultimate,  Contagion Crisis"
2025-12-26,AJOUT DE JEU,"Your Life with Naomi,  False Narrative,  Banking on Bella,  Thaloria Born to Live,  Mom Raised a Femboy,  King's Revolt,  The Pilgrimage"
2025-12-25,MISE À JOUR,Sophie: The Girl from the Zone
2025-12-25,AJOUT DE JEU,"Harem Fantasy,  Futa Fucks Femboys,  Summer for You,  Hentai Stories,  Holly Smiles at the End,  Humans Are Not That Against Lizardwomen,  Humans are not that against Lizardwomen 2,  Sexy Iron Maidens,  Astra: Ardent Show,  Getting Inside Hentai Story,  Jamie,  Two Stories"
2025-12-24,MISE À JOUR,"The Better Deal,  Sexbot II: Recalibrated"
2025-12-24,AJOUT DE JEU,"My sexy Neighbour 2,  New Beginnings in Japan"
2025-12-23,MISE À JOUR,"Ludus Master,  Shattered Minds,  Riverside Cabin,  College of Mysteria"
2025-12-23,AJOUT DE JEU,"Solvalley School,  Seeds of Chaos,  Futanari Uniform Girl RPG,  Futanari Uniform Girl,  My Real Desire,  Bound by Blood"
2025-12-23,MISE À JOUR,Demon Deals v0.07c
2025-12-22,MISE À JOUR,"Hell SexBurger,  The East Block,  Love & Sex Second Base,  Industry Baby,  Cocklemouth Village,  Echoes: The Lies We Tell Ourselves,  Isle of Fall,  Roommates,  Word of Mouth,  Victoria in Big City"
2025-12-22,AJOUT DE JEU,"Fleeting Memories,  Fantasy Opposite,  What a Legend!,  Five Night at Lust,  The Last Challenge,  Dark Magic,  The Nature of Magic,  Summer's Gone (Uncut Taboo Edition),  Life's Payback"
2025-12-21,AJOUT DE JEU,"Last Sunset,  My New Neighbors,  Multiverse Ballance"
2025-12-21,MISE À JOUR,"House Party,  Pizza Hot!,  Sunrise City,  A Wife and Mother,  Orange Smash,  Photo Hunt,  Being Super,  Milfania,  Simple Days,  Troubled Legacy"
2025-12-20,MISE À JOUR,"Boundaries of Morality,  Package Perfect,  Amnesia,  White Cube"
2025-12-20,AJOUT DE JEU,"Project « Mnemosyne »,  Zero to Harem Hero: A Hentai Isekai Adventure,  Swords and Submission,  Slave U,  Naruto: Shinobi Lord,  -u4ia-,  Moonlight,  Echoes of 2990"
2025-12-19,MISE À JOUR,"The Wish,  Becoming a Femboy,  Cabin Cruise,  Welcome to Wimblewick"
2025-12-19,AJOUT DE JEU,"Horny Hill,  Regret Island,  Missy,  Renryuu: Ascension,  Jay In The Frame,  Earn Your Freedom 3D"
2025-12-18,MISE À JOUR,"FreshWomen,  Blacked House,  Cabin Cruise,  House Chores,  Jimmy Awkward Adventures,  Projekt: Passion - S2,  Projekt: Passion - S1,  Corrupted Sponsor,  Tales From The Unending Void Season 1 (Ep 1 - 12 Extra),  May's Summer Vacation"
2025-12-18,AJOUT DE JEU,"Lilith Rising,  Strangers on Paper,  Pecker PI,  Sort of Justice,  Nephilim,  Creepy House,  Above the Law,  Invulnerable,  Yuri University,  Parasite Black,  SUCH A SHARP PAIN,  The Tower,  ADVENTURES IN LOLIWORLD,  Reconnections,  Tales from the Unending Void - S2 v0.22.1 Extra Edition,  Family Affair - Week 1 v0.73,  Family Affair - Week 2 v0.103,  Family Affair,  Reparations,  The Home,  Black New World Order,  One Lewd World"
2025-12-17,MISE À JOUR,"FreshWomen,  Locked in Temptation,  The King of Summer,  The Fall of Galadriel"
2025-12-17,AJOUT DE JEU,"Lust By Appointment: Prologue,  Midnight Sin,  Lewd Invasion,  OnlyFap- Fitness Baby,  The Obey,  College of Mysteria,  Subject 9,  My Best Deal,  Discipline: The record of a Crusade - Ren'Py Remake,  Bible Black: The Infection - Ren'Py Remake"
2025-12-16,MISE À JOUR,"Guilty Force: Wish of the Colony,  Knightly Passions,  Between Salvation and Abyss,  Grandma's House,  Symphony of the Serpent"
2025-12-16,AJOUT DE JEU,"Star Warrior and Space Girls,  Frieren and Fern in the Lewd Dungeon,  Camp Pinewood 2,  Camp Pinewood Remix,  Legacy of Hestia,  The Sunset Fairies,  Time Heals,  Lost Solace"
