date_maj,type,jeux
2025-07-13,MISE À JOUR,"The Beautiful Game,  Young Again,  Zeno's Anthology"
2025-07-12,MISE À JOUR,"Devoted Wife,  Dual Family,  A Struggle with Sin,  University of Problems"
2025-07-12,AJOUT DE JEU,"A Fantasy Life,  A Christmas Tradition,  A Big Family in Debt"
2025-07-11,MISE À JOUR,"Cartel Simulator,  Jury,  Price of Power,  Shadows of Desire,  The King of Summer,  Cursed Forest Quest,  Locked in Chastity,  How to Fix the Future,  Live to Fight"
2025-07-10,MISE À JOUR,"Where It All Began,  A Father's Sins"
2025-07-10,AJOUT DE JEU,My Ex-Future Family
2025-07-08,AJOUT DE JEU,"Chains of Pleasure,  Netori A Live,  Spirit Lover,  (D)Fraction,  SuperPowered,  Above the Law"
2025-07-08,MISE À JOUR,"Camp Pinewood Remix,  Family Faring,  Above the Law,  Restore Her Career"
2025-07-07,MISE À JOUR,"Her Heart's Desire : Remake,  My Pig Princess,  Live in Corruption,  Bible Black -La Noche de Walpurgis- Ren'Py Remake,  Amnesia"
2025-07-07,AJOUT DE JEU,"Wife's Day,  Roommate,  Broken Stones Saga,  The Last Weekend,  Thousand Days Later - Remake,  Confection Confession,  Genlock's Quest,  Dark Whispers,  Building Our Futature,  Formula Zero,  Borderline,  Lodge Days,  Little Man,  Desperate Milfs,  Pro-chan,  My Mom's Bestfriend!,  Milf Next Door 2: Hijabi Mama,  Oshun: Seduce The World,  Tavern Tales,  Blurred Lines,  Naruto: Family Vacation,  Resident X,  Nasticity,  Goss_IP volume 1,  Swing & Miss,  Sex Card Captor,  Misteries of the Burroughs Manor,  Is It Wrong That I Have a Thing for My Teacher?,  Pandemommyum,  Ocean Lust Adventures,  Fictional Story,  Girlfriend Tapes,  Possessed,  My Dark Desires,  The Fate of Irnia,  But I'm the Bad Guy?,  Blackmail and Education,  Black & White,  My Innocent Pleasure,  A Ghostly Desire,  Chemical Change Act2,  Chemical Change,  Unknown,  Magical Gene,  Staycation,  Neuronaut,  Soluble Dream,  Lycoris Radiata,  Real Life Plus Ver. Kaname Komatsuzaki,  The Wind's Disciple,  Sinful Valley,  The Rest of Our Lives,  Schoolgirls vs Elite Teacher Shinobu"
2025-07-06,AJOUT DE JEU,"Nomadic Journey,  Time Implosion,  The Last Dantr,  Countryside ~ Alone with an older girl,  Erotica,  Love and Ashes,  Depravity,  Sullied Rose,  Elvensang,  Lust Legacy,  Ray's Way,  Next Steps,  Master of Fate,  Episicava,  First Snow,  Himeko Maid,  Analistica Academy,  Hikari! Clover Rescue,  Crimson Gray: Dusk And Dawn,  Crimson Gray,  A Night to Remember,  MILF Story,  Milf Guard ,  Maternal Entanglements,  Married After 40,  Maidens of Power,  Magixxx Conquest,  Magical Family: Laboratory,  LOVE BAKUDAN,  Lust of Pain: Rework,  Lust of Pain,  Lily of the Valley Unofficial Ren'PY Remake,  Halloween's Whispered Fate,  Deals,  David VS Goliath,  Bastard Chronicles: The Shipwreck,  AuntMan,  Alice: A Hard Life,  Maids and Maidens,  Polina's Secret Part 1,  My Pig Princess,  Love Loss,  I Am Christine,  Faction Paradox,  Devilish Business,  Dual Family - Last Christmas,  Dual Family"
2025-07-06,MISE À JOUR,"Crime Lawn Repeat,  Steam Halloween Side Story],  The Lust City,  WVM"
2025-07-05,MISE À JOUR,"How to Fuck in a Zombie Apocalypse?,  Multiverse Ballance,  Instinct Unleashed,  Dog Days of Summer,  Futa Family,  Two Faceless Adventures"
2025-07-05,AJOUT DE JEU,"Mother Mix-Up,  Holiday Island"
2025-07-04,MISE À JOUR,"Last Man,  Misanthropy,  Family Mysteries,  Godson Remake"
2025-07-03,MISE À JOUR,"Camp Pinewood Remix,  Paradise Lust 2,  Amity Park"
2025-07-03,AJOUT DE JEU,"My Neighbor Looks Just Like Elasti Girl!,  The Inn"
2025-07-02,AJOUT DE JEU,"The Hard Way,  Attack on Survey Corps,  Murmur"
2025-07-02,MISE À JOUR,"Living Together!,  Sword Art Online: The Trap of Breath Concealed Magic,  Her Desire,  Heritage,  Simple Days"
2025-07-01,AJOUT DE JEU,"Inanna Revenge,  Hornycraft"
2025-07-01,MISE À JOUR,"Regret Island,  Katalist,  Surrendering to My Crush,  The Lost Love,  Parasite Black,  Nephilim"
2025-06-30,AJOUT DE JEU,"Another Chance,  Futa Inn,  FutaOS,  Lost & Found,  Origin Story"
2025-06-30,MISE À JOUR,"Futa Inn,  Academy34,  House Chores,  FutaOS,  A House in the Rift"
2025-06-29,MISE À JOUR,"SlutCraft: Heat of the Sperm,  Downfall: A Story of Corruption,  The Fall of Galadriel,  The King of Summer,  The Singer,  Henry's Adventures,  Lost at Birth,  Going Over,  Sword Art Online: The Trap of Breath Concealed Magic"
2025-06-29,AJOUT DE JEU,"My Waifu's Feet,  Sole Searching,  Futa Oasis,  Naked Ambition"
2025-06-28,MISE À JOUR,"Hail Dicktator,  Sunrise City,  Sex Gods,  Myth of Slayer,  Companion of Darkness,  Amity Park,  Guilty Pleasure,  Broken Hearts Still Want to Love,  The Fiery Scion part.3"
2025-06-28,AJOUT DE JEU,Grandma's House
2025-06-27,MISE À JOUR,"Parasite Black,  Sugar's Delight,  Incest"
2025-06-27,AJOUT DE JEU,Sword Art Online: The Trap of Breath Concealed Magic
2025-06-26,MISE À JOUR,"Boundaries of Morality,  Oppai Odyssey,  Life in Santa County,  Shelly's Future Past"
2025-06-26,AJOUT DE JEU,World of Witchcraft
2025-06-25,MISE À JOUR,"Steps of Debauchery,  The Seven Realms,  Finding Cloud 9"
2025-06-25,AJOUT DE JEU,The Swordbearer
2025-06-24,MISE À JOUR,"The Wish,  Word of Mouth,  Lust Academy,  Wishes,  Milfylicious,  Katalist,  Parasite Black,  The Red Threads"
2025-06-24,AJOUT DE JEU,Terror
2025-06-23,MISE À JOUR,"Euryale’s Gambit ,  Hooked!,  My Cute Roommate 2,  Blurred Vision,  Horton Bay Stories - Jake,  A Day at the Spa,  Affexon,  Summer in the City,  Whores of Thrones,  After the Fire,  Bubbles and Sisters,  Broken Hearts Still Want to Love,  Cabin Cruise,  Facefuck Madness Reloaded,  Futa Quest,  Waifu Inn,  A Town Uncovered"
2025-06-23,AJOUT DE JEU,"DeadMoon Survival,  University of Problems,  Crime Lawn Repeat"
2025-06-22,MISE À JOUR,"Lustfield,  Worlds of Wonders,  Corrupted Love,  Family Faring,  Divimera,  PokeSluts,  My Husband's Boss,  DickmonX Remake,  Summer SeaSon,  Living with Vicky,  Welcome to Erosland"
2025-06-22,AJOUT DE JEU,"Kicked Out Of The House,  Brothel Megacorporation,  Mind the School,  My Husband's Boss"
2025-06-21,MISE À JOUR,"Tales from the Unending Void,  Ariana’s Perverted Diary,  League of Domination,  OSC The Lust of Us,  Her Desire saison 2"
2025-06-21,AJOUT DE JEU,"AlwaysFan,  Her Desire"
2025-06-20,MISE À JOUR,"Devoted Wife,  Amnesia,  Being Super,  A Struggle with Sin"
2025-06-20,AJOUT DE JEU,"Lust Theory,  In a Heartbeat - Episode 01,  Flesh and Fury,  Lust Theory s2"
2025-06-19,MISE À JOUR,"Glowing Stones : Heroes' Awakening,  World of Sisters,  The Wants of Summer,  Multiverse Ballance,  Lust Academy"
2025-06-19,AJOUT DE JEU,"In Her Service,  Mech Academy"
2025-06-18,MISE À JOUR,"UFO,  Amnesia"
2025-06-18,AJOUT DE JEU,Distant Vows
2025-06-17,MISE À JOUR,"Rick and Morty: Another Way Home,  v0.6],  Regret Island,  ChariKiss,  Yuri University"
2025-06-17,AJOUT DE JEU,"The Story of Cindy,  The Five Star Stories,  The Cure for Madness"
2025-06-16,MISE À JOUR,"Ravager,  Incest,  Cosy Cafe,  Long Road Home,  Becoming a Femboy"
2025-06-16,AJOUT DE JEU,"Gates: The Opening,  Welcome to the MILF House!,  Heaven's Door"
2025-06-15,AJOUT DE JEU,"Domme Matrix-Tournament of Power,  Sister Wants to Help,  Christmas with My Sister"
2025-06-15,MISE À JOUR,Waifu Academy
2025-06-14,MISE À JOUR,"Naruto: Kunoichi Trainer,  Cursed Forest Quest,  Going for Goal,  Straitened Times,  Special Request: In the Web of Corruption,  Special Request: In the Web of Corruption (Kinetic Edition),  Grandma's House"
2025-06-14,AJOUT DE JEU,"Shadows of Desire: Red Room,  Road Trip,  Living with the Big-Breasted Widow ,  Damon,  Town of Passion,  New Antioch"
2025-06-13,AJOUT DE JEU,"Succubus Contract,  Taboo Request,  Now & Then,  Polyturnon,  Hero's Harem Guild,  Your Sissy Life 2.0,  Milf's Villa,  The Imaginarium,  First Change"
2025-06-13,MISE À JOUR,"Light and Dark,  Simulation 69,  Between Two Worlds,  Survivor Strain,  Lewd Invasion,  My Best Deal,  The King of Summer,  Renryuu: Ascension,  Nutting My Way Home"
2025-06-12,MISE À JOUR,"Dimitrescu's Trial,  Paradise Lust 2,  Missy"
2025-06-12,AJOUT DE JEU,"En-Fem-E No. 9: The Factory,  En-Fem-E No. 9,  Shackles of Ellswyn"
2025-06-11,MISE À JOUR,"Lustful Choices,  Empress Game,  Tamara Exposed"
2025-06-10,MISE À JOUR,"My Netorase Obsession,  Hillside"
2025-06-09,AJOUT DE JEU,60 Days Of Us
2025-06-09,MISE À JOUR,"Cross Realms,  PokeSluts,  Android LIFE,  Ring of Lust,  Cursed Forest Quest"
2025-06-08,MISE À JOUR,"My Daughter Forever,  House Party,  Stuck in My Game"
2025-06-08,AJOUT DE JEU,"Mother NTR Inn,  Scars of Summer"
2025-06-07,MISE À JOUR,"How to Fuck in a Zombie Apocalypse?,  Last Man,  Frieren and Fern in the Lewd Dungeon,  Godson Remake,  Live in Corruption,  The Simpsons Dating Sim,  Lustful Choices,  High School Master,  Creepy House,  LittleMan Remake,  Actual Roommates"
2025-06-06,MISE À JOUR,"Once a Porn a Time,  Contagion Crisis,  SexNote"
2025-06-06,AJOUT DE JEU,"Angel and Succubus,  Alvein,  Android 18 quest for the balls,  Aviva,  Natsumi and The Absurd Academy,  The Enigmatic Domain"
2025-06-05,MISE À JOUR,"Tower of Dreams,  Way of Corruption,  Academy34,  Summertime Saga"
2025-06-04,MISE À JOUR,"The Pleasuremancer,  Inkubak,  Reincarnated in Submission"
2025-06-03,MISE À JOUR,"How I Became a Hero,  One Summer in Loliwood,  Apocalypse,  Dire Desires,  Emily's Adventure,  Happy Memories: Sleeping With Sis,  MACY,  Petite Prostitution Parables,  Futa Family,  Aura Colors,  Unleashed"
2025-06-03,AJOUT DE JEU,"How I Became a Hero,  A Fresh Start,  A Night With: Succubus,  Cybernetic Seduction,  Between Her Toes"
2025-06-02,MISE À JOUR,"It Was Raining That Night,  Shattered Minds,  Serenity,  Last Human,  Away from Home,  A.I.D.A,  Star Periphery,  Facefuck Madness Reloaded,  Bible Black -La Noche de Walpurgis- Ren'Py Remake"
2025-06-02,AJOUT DE JEU,"Life in Santa County,  Ehko Island,  Reunion,  Ran Away from Home,  Feeding Gaia,  Debt,  XXX Files,  Weekend,  Training day,  Vampirella- Legacy of Lilith,  Sis, Come Back to Me,  13 Games' Project Sampler,  Fetish Locator: S&M Studio,  Meet Then Fuck - The Promotion"
2025-06-01,MISE À JOUR,"Barely Working,  The Awakening,  Countess in Crimson,  Game of Whores,  The Neverwhere Tales,  Unnatural Instinct,  Surrendering to My Crush,  Paradise Lust"
2025-06-01,AJOUT DE JEU,"Family Crush,  Midnight Terror"
2025-05-31,MISE À JOUR,"Hail Dicktator,  The Neverwhere Tales,  Boundaries of Morality,  Obscure Affairs: New Dawn,  Intertwined,  Simple Days"
2025-05-30,MISE À JOUR,"Ludus Master,  Intertwined,  Isekai Paradise"
2025-05-30,AJOUT DE JEU,Naomi: Breaking the Queen Bee
2025-05-29,MISE À JOUR,"Misanthropy,  QOSM,  The Cabin - Summer Vacation,  Live to Fight,  Grandma's House,  Regret Island,  PokeSluts,  Camp Pinewood Remix"
2025-05-29,AJOUT DE JEU,Aura Colors
2025-05-28,MISE À JOUR,"The King of Summer,  Rise or Fall,  Price of Power,  Knockout Master,  Camp Pinewood Remix,  Nephilim"
2025-05-28,AJOUT DE JEU,STEINS;GATE: Remembrance of You
2025-05-27,MISE À JOUR,The Pleasuremancer
2025-05-26,MISE À JOUR,"Lorain,  Isekai Paradise,  Contagion Crisis,  The Fall of Galadriel,  Hokage's Life,  Cross Realms"
2025-05-26,AJOUT DE JEU,A Father's Sins
2025-05-25,MISE À JOUR,"Dimitrescu's Trial,  Multiverse Ballance,  Cross Realms,  Contagion Crisis,  Isekai Paradise,  Projekt: Passion,  Symphony of the Serpent,  Shadows of Desire - RPGM version,  Price of Power,  Guilty Pleasure,  Light of My Life,  PokeSluts,  League of Domination"
2025-05-25,AJOUT DE JEU,"Lust’s Cupid (Uncensored),  Projekt: Passion,  Step Sisters Pussy"
2025-05-24,MISE À JOUR,"Frozen Past,  Monster College,  Hello Baby"
2025-05-24,AJOUT DE JEU,Accidental Hypnosis
2025-05-23,MISE À JOUR,"Lockdown 2024,  Our Home,  The Red Threads"
2025-05-23,AJOUT DE JEU,"Lethal Women: World of Femdom and Espionage,  Creepy House,  A Night with Babysitter,  My wife's cheating on me!"
2025-05-22,AJOUT DE JEU,Shadows of Desire
2025-05-22,MISE À JOUR,"Light of My Life,  Missy,  Amnesia"
2025-05-21,MISE À JOUR,"Wishes,  Project Myriam - Life and Explorations,  A Girl on a Train"
2025-05-21,AJOUT DE JEU,"Airhead Academy,  Dick's Long Hard Night,  Goddess Realm,  Infinity Crisis,  Marnie's Moment"
2025-05-20,MISE À JOUR,"Babysitters,  Frozen Past,  Milfylicious,  Cumona Beach,  Katalist"
2025-05-20,AJOUT DE JEU,"Mistress Marigold's Home Improvement,  Slutty Mommy,  Train and Tame,  Adult Education,  Just Married,  Lovephobia"
2025-05-19,MISE À JOUR,"Breeze of Passion,  Devoted Wife,  The Wish,  BizzareHolyLand,  Horton Bay Stories - Jake"
2025-05-19,AJOUT DE JEU,"Office Life,  Jessica's Choices - Origins,  My Breast Friend Sally,  Tales from the Unending Void,  Sophias sexual adventures,  My New Neighbors"
2025-05-18,AJOUT DE JEU,"Ryuko's Life Fiber Adventure,  Magic Night,  Jessincheck"
2025-05-18,MISE À JOUR,"Bible Black: La Noche de Walpurgis - Ren'Py Remake,  Doki Doki Literature Club Plus!,  The Book of Bondmaids,  Heart Problems"
2025-05-17,MISE À JOUR,"Sex Gods,  Wicked Warlocks,  Academy34,  Affexon,  Alternate Existence,  Becoming a Femboy,  Bubbles and Sisters,  Hard to Love,  Summer in the City,  Waifu Inn,  Hello Baby,  Family Mysteries,  Summer SeaSon"
2025-05-17,AJOUT DE JEU,"ChariKiss,  Alternate Existence,  Return to Roots,  Under the Same Roof,  OSC The Lust of Us"
2025-05-16,MISE À JOUR,"Katalist,  Paradise Lust 2,  Back to the Past,  One Wild Futa Nightclub,  Rick and Morty: Another Way Home"
2025-05-16,AJOUT DE JEU,"Leann sins,  Once a Porn a Time"
2025-05-15,MISE À JOUR,"Breeze of Passion,  Apocalypse Lovers,  Anna Exciting Affection,  Regret Island,  Our Red String,  Mother NTR Training,  True Husband,  Ravenous"
2025-05-15,AJOUT DE JEU,"Dawnbreaker - Aeon's Reach,  Never Meet Your Heroes"
2025-05-14,MISE À JOUR,"Mind Control,  Troubled Legacy,  My Best Deal,  Straitened Times,  Love, Honor, Betray,  Grandma's House,  Symphony of the Serpent"
2025-05-14,AJOUT DE JEU,Bible Black: La Noche de Walpurgis - Ren'Py Remake
2025-05-13,MISE À JOUR,"Regret Island,  My Netorase Obsession,  Our Red String,  Camp Pinewood Remix,  A Man for All"
2025-05-13,AJOUT DE JEU,"Myth of Slayer,  A House in the Rift"
2025-05-12,MISE À JOUR,"Corruption Town,  Goodbye Eternity,  Ravager,  Womanizer,  Family Matters,  LittleMan Remake"
2025-05-12,AJOUT DE JEU,Interim Crossroads
2025-05-11,MISE À JOUR,"World of Sisters,  Dimitrescu's Trial,  Renryuu: Ascension,  Nudist College,  Exposed,  Let It Go,  The Simpsons Dating Sim,  Hey Phil,  Live in Corruption,  Locked in Chastity,  The Lost Guardian,  Christmas Eve"
2025-05-10,MISE À JOUR,"Being Super,  Grandma's House,  Straitened Times"
2025-05-09,AJOUT DE JEU,"Super Secret Spy,  Timeless Vendetta,  Masters of the Island"
2025-05-08,AJOUT DE JEU,Price of Power
2025-05-07,MISE À JOUR,"A Struggle with Sin,  Peasant's Quest,  Downfall: A Story of Corruption,  Claire's Quest,  Knockout Master"
2025-05-07,AJOUT DE JEU,Last Hope
2025-05-06,MISE À JOUR,"Desert Stalker,  Tamara Exposed"
2025-05-05,MISE À JOUR,How to Fuck in a Zombie Apocalypse?
2025-05-05,AJOUT DE JEU,Cyberlinxxx
2025-05-04,MISE À JOUR,"Mind Control,  Bright Lord,  My Future Wife,  Mirror Mine,  WVM"
2025-05-03,MISE À JOUR,"Hail Dicktator,  Last Man,  How to Raise a Happy NEET"
2025-05-03,AJOUT DE JEU,"Your RWBY Fantasy,  Poke-Ball Academia!"
2025-05-02,MISE À JOUR,"Boundaries of Morality,  Seducing the Devil,  SlutCraft: Heat of the Sperm,  Lust Academy"
2025-05-02,AJOUT DE JEU,"Pineapple Express,  PokeLewd: For Waifus,  PokeSluts,  MAGIC of LUST,  Poke-Ball Academia 2,  Idol Island"
2025-05-01,MISE À JOUR,"MILF's Plaza,  Instinct Unleashed,  Anna Exciting Affection,  Surrendering to My Crush,  Nephilim"
2025-05-01,AJOUT DE JEU,Area69
2025-04-29,MISE À JOUR,House Party
2025-04-28,MISE À JOUR,"Angel & Demon,  Regret Island,  SexNote,  Free Pass,  Two Faceless Adventures"
2025-04-28,AJOUT DE JEU,"Lara Croft and the Lost City,  Maleficent: Banishment of Evil"
2025-04-27,AJOUT DE JEU,"Rebellion: Rise of the Damned,  Jennifer's Lustful Journey"
2025-04-27,MISE À JOUR,"Milfy Day,  Pure Harem - Short n' Sweet: My cat girl Harem"
2025-04-26,MISE À JOUR,"Glassix,  Apocalypse Lovers,  The King of Summer"
2025-04-25,MISE À JOUR,"Apocalypse Lovers,  Guilty Pleasure"
2025-04-25,AJOUT DE JEU,"Games of Depravity: The Motel,  College Stories: My Girlfriend Is Too Naive!!!"
2025-04-24,MISE À JOUR,"After That Night,  The Libido Enigma,  A Struggle with Sin,  Claire's Quest,  The Fall of Galadriel,  The Intoxicating Flavor"
2025-04-24,AJOUT DE JEU,"Rebellion The Beginning (Part 1),  Cursed Forest Quest,  Nutting My Way Home,  Breed,  Dirty Texts - Are You Sure?,  Dirty Texts - Melissa's Secret,  Dirty Texts - New Intern"
2025-04-23,MISE À JOUR,"FreshWomen,  World of Sisters,  Living with Vicky,  Ravenous,  Casual Desires,  LittleMan Remake"
2025-04-23,AJOUT DE JEU,"Being Super,  The Wants of Summer,  Tropicali,  Amnesia,  Academy Love,  Ben 10: A day with Gwen,  My Real Desire,  Driven by Desire"
2025-04-22,MISE À JOUR,Nephilim
2025-04-21,MISE À JOUR,"The Wish,  Lust Academy,  Misanthropy"
2025-04-21,AJOUT DE JEU,Alexandra
2025-04-20,AJOUT DE JEU,"Kara,  Let It Go,  Family Chemistry,  Sparkling Duplicity,  Girls on a Train,  Lost in Paradise,  Witchcraft,  Deliverance,  Trouble iN The aRena,  New Horizon,  Cross Realms"
2025-04-20,MISE À JOUR,Friends in Need
2025-04-19,MISE À JOUR,"Dimitrescu's Trial,  Our Red String,  Horton Bay Stories - Jake,  Immoral Stories Rebecca,  Artemis,  Lewd Invasion,  Knockout Master,  Simple Days,  Welcome to Erosland"
2025-04-18,MISE À JOUR,"The Awakening,  FreshWomen,  Prince of Suburbia"
2025-04-18,AJOUT DE JEU,Knockout Master
2025-04-17,MISE À JOUR,"Agent17,  Downfall: A Story of Corruption"
2025-04-17,AJOUT DE JEU,"House Chores,  No Mercy,  The Remains of a Life,  Occultus: DoD,  Boundaries of Morality,  Pokégirl Paradise,  Pokémon Xnap"
2025-04-16,MISE À JOUR,"House Party,  Monster College,  SlutCraft: Heat of the Sperm,  The Fiery Scion"
2025-04-14,MISE À JOUR,"Shattered Minds,  Renryuu: Ascension"
2025-04-14,AJOUT DE JEU,Locked in Temptation
2025-04-13,MISE À JOUR,"Ravager,  Empress Game"
2025-04-13,AJOUT DE JEU,Summer of Love
2025-04-12,MISE À JOUR,"Lockdown 2024,  Shattered Minds,  Croft Adventures,  Straitened Times"
2025-04-11,MISE À JOUR,"World of Sisters,  Dream City Demo,  Multiverse Ballance,  My Best Deal,  Regret Island"
2025-04-11,AJOUT DE JEU,"Harvesting Corruption,  Em-8ER,  Living With My Sisters 2,  Sisterly Camp"
2025-04-10,MISE À JOUR,Artemis
2025-04-10,AJOUT DE JEU,"Incest Story- Mother and Aunt,  Incest Tales: Sister and Mom,  Debbie,  I'LL FUCK YOUR GRANDPA!,  The Mother of My Best Friend and Her Irresistible Desires "
2025-04-09,MISE À JOUR,"Amnesia,  That New Teacher,  Long Road Home,  Android LIFE,  Futa Family"
2025-04-09,AJOUT DE JEU,Isekai Paradise
2025-04-08,AJOUT DE JEU,Downfall: A Story of Corruption
2025-04-08,MISE À JOUR,"Cartel Simulator,  Game of Hearts,  Peasant's Quest,  The King of Summer"
2025-04-07,MISE À JOUR,"Misanthropy,  Neko Paradise,  Milfylicious"
2025-04-06,MISE À JOUR,"Live in Corruption,  Saya no Uta ~ The Song Of Saya,  Saya no Uta ~ The Song Of Saya - Original version,  Summer SeaSon,  How I Became a Hero"
2025-04-06,AJOUT DE JEU,"Sugar's Delight,  X-Change - Complete Classic Dating-Sim Collection"
2025-04-05,MISE À JOUR,"Hail Dicktator,  Actual Roommates"
2025-04-04,MISE À JOUR,"How to Fuck in a Zombie Apocalypse?,  Last Man,  Horton Bay Stories - Jake,  WVM,  Project Myriam - Life and Explorations"
2025-04-04,AJOUT DE JEU,Saya no Uta ~ The Song Of Saya
2025-04-03,MISE À JOUR,"A Wife and Mother Part.2,  A Wife and Mother Part.1,  Single Mother,  Lustfield,  Wife in the Building!"
2025-04-03,AJOUT DE JEU,"Parasite Black,  After the Inferno"
2025-04-02,AJOUT DE JEU,Dog Days of Summer
2025-04-01,MISE À JOUR,"Yuri University,  Surrendering to My Crush,  Kingdom of Lust,  WVM"
2025-04-01,AJOUT DE JEU,"Gomamon Trainer,  How to Fix the Future,  WVM Day in the Life of: Harper"
2025-03-30,MISE À JOUR,"Legacy of Hestia,  My Best Deal,  Persona 4: Rise Gaiden,  Dimitrescu's Trial,  Regret Island,  Instinct Unleashed"
2025-03-30,AJOUT DE JEU,Persona 5: Euphoria
2025-03-29,MISE À JOUR,"The Beautiful Game,  Actual Roommates,  Ataegina,  The College,  The Fall of Galadriel"
2025-03-28,AJOUT DE JEU,SEX EXIT
2025-03-28,MISE À JOUR,"A Heartfelt Visit,  Cartel Simulator,  Guilty Pleasure,  Ravenous,  Special Request: In the Web of Corruption,  Special Request: In the Web of Corruption (Kinetic Edition)"
2025-03-27,AJOUT DE JEU,"Sex Therapy,  FateLewd Order"
2025-03-27,MISE À JOUR,"Our Red String,  What a Legend!,  Frieren and Fern in the Lewd Dungeon,  Going for Goal"
2025-03-26,MISE À JOUR,"16 Years Later!,  Simple Days,  Single Again,  The Singer"
2025-03-25,MISE À JOUR,"Desert Stalker,  Being a DIK,  Reunion"
2025-03-23,MISE À JOUR,"Futa School,  Jennifer's Life,  Camp Pinewood Remix"
2025-03-23,AJOUT DE JEU,"Our Red String,  Nursing Back to Pleasure"
2025-03-22,AJOUT DE JEU,"Emi - The Long Road Home,  Emi - New Beginning,  My New Memories: The Beginning"
2025-03-22,MISE À JOUR,My Netorase Obsession
2025-03-21,AJOUT DE JEU,Julie's Room
2025-03-19,MISE À JOUR,"The Builder,  A Struggle with Sin,  Wishes,  Victoria in Big City"
2025-03-19,AJOUT DE JEU,"Realm Invader,  Aiden's Revenge,  All Ashes and Illusions,  Alternate Existence"
2025-03-18,MISE À JOUR,"Symphony of the Serpent,  Bright Lord,  BizzareHolyLand"
2025-03-17,AJOUT DE JEU,"The College,  Mythic Manor"
2025-03-16,MISE À JOUR,"Tamara Exposed,  Zeno's Anthology,  Laura: Island Adventures,  Simple Days"
2025-03-15,MISE À JOUR,"Wife in the Building!,  Regret Island,  Dimitrescu's Trial,  Pale Carnations,  Driven Affairs,  Nympho Tamer"
2025-03-15,AJOUT DE JEU,Companion of Darkness
2025-03-14,MISE À JOUR,"Single Mother,  True Husband"
2025-03-13,AJOUT DE JEU,"DeeDee's Home and the Haunting of Halloween Manor,  Kidnapped On Halloween,  Sweet Summer Days"
2025-03-12,AJOUT DE JEU,Boxed In
2025-03-12,MISE À JOUR,"Normal Life under Feet,  Ring of Lust"
2025-03-11,MISE À JOUR,"Living with Vicky,  Multiverse Ballance"
2025-03-11,AJOUT DE JEU,Secrets of the Family
2025-03-10,MISE À JOUR,"Live in Corruption,  Exposed"
2025-03-10,AJOUT DE JEU,The Lost Love
2025-03-09,MISE À JOUR,"A Struggle with Sin,  Symphony of the Serpent,  Lewd Invasion,  Futa Family"
2025-03-08,MISE À JOUR,"Project Myriam - Life and Explorations,  SnowStorm,  Futa School,  Straitened Times,  Renryuu: Ascension,  Surrendering to My Crush"
2025-03-07,MISE À JOUR,"Misanthropy,  Becoming a Femboy,  BizzareHolyLand,  LittleMan Remake"
2025-03-07,AJOUT DE JEU,Whores of Thrones
2025-03-06,AJOUT DE JEU,"A Town Uncovered,  Childhood Friends,  Free Use House,  Shameless Afterparty,  Turning the Page"
2025-03-06,MISE À JOUR,Locked in Chastity
2025-03-05,MISE À JOUR,"Dreams of Desire: The Lost Memories,  Projekt: Passion,  Reconnections,  War of Mine,  Ravenous,  Guilty Pleasure,  A Family Venture,  Lust Academy,  Zombie's Retreat,  Grandma's House: College Days,  Winter Memories,  Back to the Past"
2025-03-04,AJOUT DE JEU,"All Demons Go to Heaven,  MsP & MsD,  Christmas Gift,  Campus Lyfe"
2025-03-03,MISE À JOUR,DickmonX Remake
2025-03-02,MISE À JOUR,"Photo Hunt,  Simple Days"
2025-03-01,MISE À JOUR,"Wife in the Building!,  Summer SeaSon"
2025-02-28,MISE À JOUR,Live in Corruption
2025-02-28,AJOUT DE JEU,"The Yuri Doctor,  Tiffany's Cliff House,  Stroking is too easy,  Young Valery's Holiday Job,  Valery's first session"
2025-02-27,AJOUT DE JEU,"Silent House,  Sorcerer's Paradox,  Surviving My Family,  The Fall of Galadriel"
2025-02-26,AJOUT DE JEU,"Olivia's Bad Day,  Pure Harem - Short n' Sweet: My cat girl Harem,  Doki Doki Literature Club Plus!,  Roommate Took My Gf,  Feline Fantasies,  Indoctrination"
2025-02-26,MISE À JOUR,"Legacy of Hestia,  Regret Island"
2025-02-25,MISE À JOUR,"Dimitrescu's Trial,  Wicked Warlocks"
2025-02-25,AJOUT DE JEU,"Mist of Her Body,  Lustful Choices,  ¡Ay, Caramba!,  My Husband's Boss,  Shadows of Desire - Unofficial Ren'Py Port"
2025-02-24,AJOUT DE JEU,"Golden Mean,  4 Years in Tehran"
2025-02-23,AJOUT DE JEU,"Married After 40 - Holiday Special,  Demon Wake,  Shinigami Love"
2025-02-23,MISE À JOUR,"The Cabin - Summer Vacation,  Landlord &amp; the Tenants,  Sexy Acquaintances"
2025-02-22,MISE À JOUR,"Horton Bay Stories - Jake,  A Wife and Mother,  Family Mysteries,  Futa School,  Roommates,  The Lewd Deal"
2025-02-22,AJOUT DE JEU,"Fetish Stories: The Asylum,  Isolated with Mom"
2025-02-21,AJOUT DE JEU,"Sakura Gozen,  Katalist"
2025-02-21,MISE À JOUR,New Year's Day(e)
2025-02-20,MISE À JOUR,"Getting Intimate,  Exposed"
2025-02-19,MISE À JOUR,"A Family Venture,  My Netorase Obsession,  Futa Family"
2025-02-18,MISE À JOUR,"Sexy Acquaintances,  The Lewd Deal,  Symphony of the Serpent"
2025-02-17,AJOUT DE JEU,"Innkeeper,  Renryuu: Ascension,  Light and Dark"
2025-02-17,MISE À JOUR,"Worlds of Wonders,  Multiverse Ballance"
2025-02-16,AJOUT DE JEU,"Escape From The Princess,  Futa Forest"
2025-02-16,MISE À JOUR,Divimera
2025-02-15,AJOUT DE JEU,"League of Domination,  Cuckold's Gym,  Dirty Fantasies: Master's Help"
2025-02-14,AJOUT DE JEU,"Crown of Desire,  Brandy,  Claire's Quest"
2025-02-14,MISE À JOUR,New Year's Day(e)
2025-02-13,AJOUT DE JEU,"Demon Charmer,  Countryside Dating,  Perfect Housewife,  Watching My Wife,  Friends in Need,  Love &amp; Sex Second Base,  MILF Breeder,  Apocalust,  Rebel Duet,  Finding Cloud 9,  Knightly Passions"
2025-02-13,MISE À JOUR,"My Employee's Family,  Twisted Memories,  Harem Hotel,  Cosy Cafe,  Accord,  Contagion Crisis,  Long Road Home,  Eternum,  That New Teacher,  Money or Morals,  Companion of Darkness"
2025-02-12,MISE À JOUR,"Midnight Paradise,  Binding Sim,  My New Girlfriend,  Regret Island,  Welcome to Erosland,  Wishes,  Lust Academy"
2025-02-12,AJOUT DE JEU,"The Tyrant,  Shy Girl"
